web-scraper-order,web-scraper-start-url,cat,cat-href,page,page-href,title,title-href,info
"1522286238-2640","http://www.cookbooks.com/","Pizza","http://www.cookbooks.com/recipes-search.aspx?id=1&tag=pizza","14","http://www.cookbooks.com/recipes-search.aspx?page=14","197. MEXICAN PIZZAS","http://www.cookbooks.com/Recipe-Details.aspx?id=22564","<p class=""H2""><font size=""5"">MEXICAN PIZZAS</font><br><span class=""H2""><font size=""4""><i></i></font></span><br></p><hr><p class=""H3""><strong></strong></p><table width=""100%"" border=""1px"" cellspacing=""0"" cellpadding=""10""><tbody><tr><td><span class=""H2"">ingredients</span><br><p class=""H1"">12  corn tortillas<br>1  lb. ground sirloin<br>1  green pepper, sliced in thin strips<br>1  red pepper, sliced in thin strips<br>1  (1.25 oz.) packet taco seasoning<br>2  Tbsp. refried beans (canned)<br>  shredded taco cheese blend<br></p></td></tr></tbody></table><table width=""100%"" border=""1px"" cellspacing=""0"" cellpadding=""10""><tbody><tr><td><span class=""H2"">preparation</span><br><p class=""H1"">      Preheat oven to 425°.  Place 2 baking sheets with corn tortillas overlapping (coat both sides of tortillas with cooking spray) in oven. Bake 7 minutes; flip tortillas over. Rotate pans. Bake until lightly brown, 7 minutes. In large nonstick skillet, brown round sirloin, breaking up clumps.  Stir in green and red peppers. Add taco seasoning. Cook 4 minutes. Spread tortillas with refried beans or you could use bean dip.  Top each with heaping 1/4 cup meat and 2 tablespoons cheese.  Bake 2 minutes to melt cheese.</p></td></tr></tbody></table>"
"1522286013-2541","http://www.cookbooks.com/","Pizza","http://www.cookbooks.com/recipes-search.aspx?id=1&tag=pizza","20","http://www.cookbooks.com/recipes-search.aspx?page=20","296. VEGETABLE PIZZA","http://www.cookbooks.com/Recipe-Details.aspx?id=33849","<p class=""H2""><font size=""5"">VEGETABLE PIZZA</font><br><span class=""H2""><font size=""4""><i></i></font></span><br></p><hr><p class=""H3""><strong></strong></p><table width=""100%"" border=""1px"" cellspacing=""0"" cellpadding=""10""><tbody><tr><td><span class=""H2"">ingredients</span><br><p class=""H1"">2  cans crescent rolls<br>8  oz. softened cream cheese<br>16  oz. sour cream<br>1  pkg. Hidden Valley Ranch dip<br>  favorite chopped veggies<br>  Cheddar cheese<br>  bacon bits<br></p></td></tr></tbody></table><table width=""100%"" border=""1px"" cellspacing=""0"" cellpadding=""10""><tbody><tr><td><span class=""H2"">preparation</span><br><p class=""H1"">      Press crescent rolls on a 17 x 11 cookie pan. Bake at 375° for 10 minutes. While hot, spread on cream cheese. Next, mix sour cream with Hidden Valley Ranch dip mix. Spread over cream cheese. Top with your favorite veggies. Add Cheddar cheese and bacon bits. Keep chilled.</p><p class=""H1"">       For veggies, broccoli, onion, green pepper, carrots, fresh mushrooms or any combo you prefer.</p></td></tr></tbody></table>"
"1522286411-2715","http://www.cookbooks.com/","Pizza","http://www.cookbooks.com/recipes-search.aspx?id=1&tag=pizza","9","http://www.cookbooks.com/recipes-search.aspx?page=9","122. STRAWBERRY PIZZA","http://www.cookbooks.com/Recipe-Details.aspx?id=13289","<p class=""H1"">Could NOT Open Recipe Page Due To:</p>Conversion from type 'DBNull' to type 'String' is not valid."
"1522286253-2646","http://www.cookbooks.com/","Pizza","http://www.cookbooks.com/recipes-search.aspx?id=1&tag=pizza","13","http://www.cookbooks.com/recipes-search.aspx?page=13","191. PIZZA ROLLS","http://www.cookbooks.com/Recipe-Details.aspx?id=22215","<p class=""H2""><font size=""5"">PIZZA ROLLS</font><br><span class=""H2""><font size=""4""><i></i></font></span><br></p><hr><p class=""H3""><strong></strong></p><table width=""100%"" border=""1px"" cellspacing=""0"" cellpadding=""10""><tbody><tr><td><span class=""H2"">ingredients</span><br><p class=""H1"">1  tube pizza crust<br>1 small  jar pizza sauce<br>1  pkg. pepperoni<br>12  oz. Mozzarella<br>1/2  c. Parmesan cheese<br>2  tsp. melted margarine<br>1/2  c. flour<br></p></td></tr></tbody></table><table width=""100%"" border=""1px"" cellspacing=""0"" cellpadding=""10""><tbody><tr><td><span class=""H2"">preparation</span><br><p class=""H1"">      Sprinkle flour on waxed paper.  Place pizza crust on floured surface in rectangular form.  Spread on sauce.  Cover with pepperoni, top with Mozzarella and gently roll up from one side to the other.  Brush with melted margarine and sprinkle with Parmesan cheese.  Bake at 350° for 12 minutes.</p></td></tr></tbody></table>"
"1522286499-2752","http://www.cookbooks.com/","Pizza","http://www.cookbooks.com/recipes-search.aspx?id=1&tag=pizza","6","http://www.cookbooks.com/recipes-search.aspx?page=6","85. PASGHETTI PIZZA","http://www.cookbooks.com/Recipe-Details.aspx?id=8368","<p class=""H1"">Could NOT Open Recipe Page Due To:</p>Conversion from type 'DBNull' to type 'String' is not valid."
"1522286021-2545","http://www.cookbooks.com/","Pizza","http://www.cookbooks.com/recipes-search.aspx?id=1&tag=pizza","20","http://www.cookbooks.com/recipes-search.aspx?page=20","292. PIZZA APPETIZERS","http://www.cookbooks.com/Recipe-Details.aspx?id=33492","<p class=""H2""><font size=""5"">PIZZA APPETIZERS</font><br><span class=""H2""><font size=""4""><i></i></font></span><br></p><hr><p class=""H3""><strong></strong></p><table width=""100%"" border=""1px"" cellspacing=""0"" cellpadding=""10""><tbody><tr><td><span class=""H2"">ingredients</span><br><p class=""H1"">1  pound pork sausage<br>1  pound velveeta cheese<br>3  tablespoons catsup<br>2  tablespoons oregano<br>  dash of garlic powder<br></p></td></tr></tbody></table><table width=""100%"" border=""1px"" cellspacing=""0"" cellpadding=""10""><tbody><tr><td><span class=""H2"">preparation</span><br><p class=""H1"">      Brown sausage; drain and add cheese and other ingredients. Let cheese melt and mix well.  Let it cool a little and then spread on party rye.  Bake 5 minutes at 350°.</p></td></tr></tbody></table>"
"1522286477-2743","http://www.cookbooks.com/","Pizza","http://www.cookbooks.com/recipes-search.aspx?id=1&tag=pizza","7","http://www.cookbooks.com/recipes-search.aspx?page=7","94. PIZZA MUFFINS","http://www.cookbooks.com/Recipe-Details.aspx?id=8961","<p class=""H2""><font size=""5"">PIZZA MUFFINS</font><br><span class=""H2""><font size=""4""><i></i></font></span><br></p><hr><p class=""H3""><strong></strong></p><table width=""100%"" border=""1px"" cellspacing=""0"" cellpadding=""10""><tbody><tr><td><span class=""H2"">ingredients</span><br><p class=""H1"">  sourdough muffins<br>1  can tomato paste<br>1  Tbsp. sugar<br>  pinch of oregano<br>1  pkg. shredded Mozzarella cheese<br>  green olives, sliced<br>1  pkg. pepperoni<br></p></td></tr></tbody></table><table width=""100%"" border=""1px"" cellspacing=""0"" cellpadding=""10""><tbody><tr><td><span class=""H2"">preparation</span><br><p class=""H1"">      Cut muffins in half. Mix tomato paste, sugar and oregano; spread onto muffins. Place pepperoni, olives and cheese on muffins and bake at 375° until golden brown.</p><p class=""H1"">      Can add or take away any toppings as desired.</p></td></tr></tbody></table>"
"1522286438-2727","http://www.cookbooks.com/","Pizza","http://www.cookbooks.com/recipes-search.aspx?id=1&tag=pizza","8","http://www.cookbooks.com/recipes-search.aspx?page=8","110. VEGETABLE PIZZA I","http://www.cookbooks.com/Recipe-Details.aspx?id=10662","<p class=""H2""><font size=""5"">VEGETABLE PIZZA I</font><br><span class=""H2""><font size=""4""><i></i></font></span><br></p><hr><p class=""H3""><strong></strong></p><table width=""100%"" border=""1px"" cellspacing=""0"" cellpadding=""10""><tbody><tr><td><span class=""H2"">ingredients</span><br><p class=""H1"">1  container crescent roll dough<br>1  c. low-fat sour cream<br>1/2  c. Ranch dressing<br>  Italian seasoning to taste<br>  chopped vegetables of your choice (cauliflower, tomatoes, peppers and onions)<br></p></td></tr></tbody></table><table width=""100%"" border=""1px"" cellspacing=""0"" cellpadding=""10""><tbody><tr><td><span class=""H2"">preparation</span><br><p class=""H1"">	Pat dough in a round pizza pan.  Bake at 350° for 10 minutes. Cool.  Add Ranch dressing to sour cream and season to taste with Italian seasoning.	Spread on baked crescent rolls.  Layer chopped veggies on top of dressing mixture.  Chill.</p></td></tr></tbody></table>"
"1522286488-2747","http://www.cookbooks.com/","Pizza","http://www.cookbooks.com/recipes-search.aspx?id=1&tag=pizza","6","http://www.cookbooks.com/recipes-search.aspx?page=6","90. PIZZA HOTDISH","http://www.cookbooks.com/Recipe-Details.aspx?id=8595","<p class=""H2""><font size=""5"">PIZZA HOTDISH</font><br><span class=""H2""><font size=""4""><i></i></font></span><br></p><hr><p class=""H3""><strong></strong></p><table width=""100%"" border=""1px"" cellspacing=""0"" cellpadding=""10""><tbody><tr><td><span class=""H2"">ingredients</span><br><p class=""H1"">1  lb. ground beef<br>1/4  c. chopped green pepper, if desired<br>2  cans condensed tomato soup<br>1/2  tsp. garlic salt<br>1/2  tsp. oregano<br>1/2  tsp. onion salt<br>1/4  tsp. pepper<br>6  oz. cooked noodles<br>  sliced fresh or canned mushrooms<br>1/4  lb. grated cheddar cheese<br>1/4  C. grated parmesan cheese<br></p></td></tr></tbody></table><table width=""100%"" border=""1px"" cellspacing=""0"" cellpadding=""10""><tbody><tr><td><span class=""H2"">preparation</span><br><p class=""H1"">      Brown meat, add peppers and sauté, add soup and spices simmer.  Cook noodles per package instructions. Grease 9x13 pan. Pour in noodles, cover with meat sauce, then mushrooms and cheeses.  Bake covered 35 min. at 350 degrees.  Then bake uncovered for 10 min. more. Serves 6.</p></td></tr></tbody></table>"
"1522286405-2712","http://www.cookbooks.com/","Pizza","http://www.cookbooks.com/recipes-search.aspx?id=1&tag=pizza","9","http://www.cookbooks.com/recipes-search.aspx?page=9","125. FRUIT PIZZA","http://www.cookbooks.com/Recipe-Details.aspx?id=13613","<p class=""H2""><font size=""5"">FRUIT PIZZA</font><br><span class=""H2""><font size=""4""><i></i></font></span><br></p><hr><p class=""H3""><strong></strong></p><table width=""100%"" border=""1px"" cellspacing=""0"" cellpadding=""10""><tbody><tr><td><span class=""H2"">ingredients</span><br><p class=""H1"">1  tube sugar cookie dough<br>8  oz. cream cheese (do not use reduced or fat-free)<br>1/2  c. powdered sugar<br>  any assortment fresh or canned fruit<br>1  c. fruit juice (orange juice is good)<br>2  Tbsp. cornstarch<br></p></td></tr></tbody></table><table width=""100%"" border=""1px"" cellspacing=""0"" cellpadding=""10""><tbody><tr><td><span class=""H2"">preparation</span><br><p class=""H1"">      Press sugar cookie dough into a pizza or cookie pan. Bake at 400° for 10 to 15 minutes. Cool crust completely.</p><p class=""H1"">      Combine cream cheese and powdered sugar. Spread over batter. Arrange fruit on cream cheese. Combine juice and cornstarch and cook until slightly thick. Pour over pizza and refrigerate.</p></td></tr></tbody></table>"
"1522286614-2798","http://www.cookbooks.com/","Pizza","http://www.cookbooks.com/recipes-search.aspx?id=1&tag=pizza","3","http://www.cookbooks.com/recipes-search.aspx?page=3","39. STRAWBERRY PIZZA","http://www.cookbooks.com/Recipe-Details.aspx?id=3968","<p class=""H2""><font size=""5"">STRAWBERRY PIZZA</font><br><span class=""H2""><font size=""4""><i></i></font></span><br></p><hr><p class=""H3""><strong>Crust:</strong></p><table width=""100%"" border=""1px"" cellspacing=""0"" cellpadding=""10""><tbody><tr><td><span class=""H2"">ingredients</span><br><p class=""H1"">1 1/2  c. self-rising flour<br>1 1/2  sticks butter or margarine<br>1  c. chopped nuts<br>2  Tbsp. sugar<br></p></td></tr></tbody></table><table width=""100%"" border=""1px"" cellspacing=""0"" cellpadding=""10""><tbody><tr><td><span class=""H2"">preparation</span><br><p class=""H1"">      Mix together and press in a pizza pan.  Bake 10 to 15 minutes at 350°.  Let cool.</p></td></tr></tbody></table><p class=""H3""><strong>Filling:</strong></p><table width=""100%"" border=""1px"" cellspacing=""0"" cellpadding=""10""><tbody><tr><td><span class=""H2"">ingredients</span><br><p class=""H1"">8  oz. cream cheese<br>2  c. powdered sugar<br>8  oz. whipped topping<br></p></td></tr></tbody></table><table width=""100%"" border=""1px"" cellspacing=""0"" cellpadding=""10""><tbody><tr><td><span class=""H2"">preparation</span><br><p class=""H1"">      Cream together powdered sugar and cream cheese.  Fold in whipped topping.  Spread this over cooked crust.</p></td></tr></tbody></table><p class=""H3""><strong>Glaze:</strong></p><table width=""100%"" border=""1px"" cellspacing=""0"" cellpadding=""10""><tbody><tr><td><span class=""H2"">ingredients</span><br><p class=""H1"">1  pt. mashed strawberries<br>1/4  c. sugar<br>2  Tbsp. cornstarch<br>1/3  c. water<br></p></td></tr></tbody></table><table width=""100%"" border=""1px"" cellspacing=""0"" cellpadding=""10""><tbody><tr><td><span class=""H2"">preparation</span><br><p class=""H1"">      Mix well and cook until thick.  (You can add chopped almonds or vanilla extract, if desired.)  Cool and spread on the cream cheese mixture.  Arrange 1 pint sliced strawberries on top.</p></td></tr></tbody></table>"
"1522286219-2631","http://www.cookbooks.com/","Pizza","http://www.cookbooks.com/recipes-search.aspx?id=1&tag=pizza","14","http://www.cookbooks.com/recipes-search.aspx?page=14","206. PIZZA BURGER SANDWICHES","http://www.cookbooks.com/Recipe-Details.aspx?id=22704","<p class=""H2""><font size=""5"">PIZZA BURGER SANDWICHES</font><br><span class=""H2""><font size=""4""><i></i></font></span><br></p><hr><p class=""H3""><strong></strong></p><table width=""100%"" border=""1px"" cellspacing=""0"" cellpadding=""10""><tbody><tr><td><span class=""H2"">ingredients</span><br><p class=""H1"">2  lb. ground beef or 6 (1/3 lb.) patties<br>12  slices pizza (great use for leftover pizza; plain, pepperoni or sausage work best)<br></p></td></tr></tbody></table><table width=""100%"" border=""1px"" cellspacing=""0"" cellpadding=""10""><tbody><tr><td><span class=""H2"">preparation</span><br><p class=""H1"">      Grill or fry burgers (use 1/3 pound patties or smaller; larger ones are hard to handle); season them to your personal taste. Do not overcook.</p><p class=""H1"">       Set out 6 slices of pizza. Place cooked burgers on top of pizza slices. Cover burgers with remaining pizza slices, with topping side of pizza touching the burger. Wrap each pizza sandwich in foil. Bake at 350° for 10 to 15 minutes. Serve as a whole sandwich or quartered on a plate covered in pizza sauce.</p></td></tr></tbody></table>"
"1522286273-2654","http://www.cookbooks.com/","Pizza","http://www.cookbooks.com/recipes-search.aspx?id=1&tag=pizza","13","http://www.cookbooks.com/recipes-search.aspx?page=13","183. PIZZA SALAD","http://www.cookbooks.com/Recipe-Details.aspx?id=21693","<p class=""H2""><font size=""5"">PIZZA SALAD</font><br><span class=""H2""><font size=""4""><i></i></font></span><br></p><hr><p class=""H3""><strong></strong></p><table width=""100%"" border=""1px"" cellspacing=""0"" cellpadding=""10""><tbody><tr><td><span class=""H2"">ingredients</span><br><p class=""H1"">1  lb. spiral macaroni, cooked<br>3  tomatoes, diced<br>1  lb. shredded cheese<br>2  bunches green onions<br>3  oz. pepperoni<br>3/4  c. vinegar<br>2/3  c. Parmesan cheese<br>2  tsp. oregano<br>3/4  c. vegetable oil<br>1  tsp. garlic powder<br>1  tsp. salt<br>1/4  tsp. pepper<br></p></td></tr></tbody></table><table width=""100%"" border=""1px"" cellspacing=""0"" cellpadding=""10""><tbody><tr><td><span class=""H2"">preparation</span><br><p class=""H1"">      Combine last 5 ingredients and pour over first 5.</p></td></tr></tbody></table>"
"1522286182-2614","http://www.cookbooks.com/","Pizza","http://www.cookbooks.com/recipes-search.aspx?id=1&tag=pizza","15","http://www.cookbooks.com/recipes-search.aspx?page=15","223. PIZZA CASSEROLE","http://www.cookbooks.com/Recipe-Details.aspx?id=23726","<p class=""H2""><font size=""5"">PIZZA CASSEROLE</font><br><span class=""H2""><font size=""4""><i></i></font></span><br></p><hr><p class=""H3""><strong></strong></p><table width=""100%"" border=""1px"" cellspacing=""0"" cellpadding=""10""><tbody><tr><td><span class=""H2"">ingredients</span><br><p class=""H1"">1  lb. sausage<br>2  c. macaroni, cooked and drained<br>1  jar Ragu pizza sauce<br>1  pkg. pepperoni<br>1 (10 oz.)  pkg. Mozzarella cheese<br>  mushrooms (optional)<br></p></td></tr></tbody></table><table width=""100%"" border=""1px"" cellspacing=""0"" cellpadding=""10""><tbody><tr><td><span class=""H2"">preparation</span><br><p class=""H1"">      Brown meat.  In casserole dish, layer the following: meat, macaroni, pizza sauce, pepperoni and cheese.  Repeat layers, ending with cheese.  Bake at 350° for 25 to 30 minutes.</p></td></tr></tbody></table>"
"1522286180-2613","http://www.cookbooks.com/","Pizza","http://www.cookbooks.com/recipes-search.aspx?id=1&tag=pizza","15","http://www.cookbooks.com/recipes-search.aspx?page=15","224. BREAKFAST PIZZA","http://www.cookbooks.com/Recipe-Details.aspx?id=23734","<p class=""H2""><font size=""5"">BREAKFAST PIZZA</font><br><span class=""H2""><font size=""4""><i></i></font></span><br></p><hr><p class=""H3""><strong></strong></p><table width=""100%"" border=""1px"" cellspacing=""0"" cellpadding=""10""><tbody><tr><td><span class=""H2"">ingredients</span><br><p class=""H1"">1  pkg. refrigerated crescent rolls<br>1  lb. sausage<br>1 (8 or 10 oz.)  pkg. shredded Cheddar cheese or Velveeta<br>3  eggs<br>1/4  c. milk<br>  salt and pepper to taste<br></p></td></tr></tbody></table><table width=""100%"" border=""1px"" cellspacing=""0"" cellpadding=""10""><tbody><tr><td><span class=""H2"">preparation</span><br><p class=""H1"">      Brown sausage and drain.  Press out crescent rolls in a pizza pan or cookie sheet until bottom is entirely covered.   Spread sausage over the uncooked crust and then the shredded cheese. Stir the eggs and milk together, then pour over the crust mixture. Bake in preheated oven at 350° for 20 minutes.</p></td></tr></tbody></table>"
"1522286266-2652","http://www.cookbooks.com/","Pizza","http://www.cookbooks.com/recipes-search.aspx?id=1&tag=pizza","13","http://www.cookbooks.com/recipes-search.aspx?page=13","185. PIZZA SAUCE","http://www.cookbooks.com/Recipe-Details.aspx?id=21763","<p class=""H2""><font size=""5"">PIZZA SAUCE</font><br><span class=""H2""><font size=""4""><i></i></font></span><br></p><hr><p class=""H3""><strong></strong></p><table width=""100%"" border=""1px"" cellspacing=""0"" cellpadding=""10""><tbody><tr><td><span class=""H2"">ingredients</span><br><p class=""H1"">1  c. pepperoni, grated<br>1  can tomato paste<br>1  can water in paste<br>1  qt. tomato juice<br>1  onion, grated<br>  celery or salt<br>  oregano to taste<br></p></td></tr></tbody></table><table width=""100%"" border=""1px"" cellspacing=""0"" cellpadding=""10""><tbody><tr><td><span class=""H2"">preparation</span><br><p class=""H1"">      Add all ingredients together and cook slowly 2 hours or until thick.</p></td></tr></tbody></table>"
"1522286100-2579","http://www.cookbooks.com/","Pizza","http://www.cookbooks.com/recipes-search.aspx?id=1&tag=pizza","18","http://www.cookbooks.com/recipes-search.aspx?page=18","258. CANDY SHOP PIZZA","http://www.cookbooks.com/Recipe-Details.aspx?id=29000","<p class=""H2""><font size=""5"">CANDY SHOP PIZZA</font><br><span class=""H2""><font size=""4""><i></i></font></span><br></p><hr><p class=""H3""><strong></strong></p><table width=""100%"" border=""1px"" cellspacing=""0"" cellpadding=""10""><tbody><tr><td><span class=""H2"">ingredients</span><br><p class=""H1"">1  tube refrigerator sugar cookie dough or chocolate chip cookie dough<br>1/2  c. peanut butter<br>1  c. semi-sweet chocolate chips<br>1  c. chopped candy bars such as Nestle Crunch bars, Butterfinger, Alpine white, Goobers and Raisinets<br>1  c. cut up fruit like bananas and strawberries (optional)<br></p></td></tr></tbody></table><table width=""100%"" border=""1px"" cellspacing=""0"" cellpadding=""10""><tbody><tr><td><span class=""H2"">preparation</span><br><p class=""H1"">      Preheat oven to 375°.  Slice cookie dough and spread out dough into a 12 to 14-inch pizza pan.  Bake 20 to 24 minutes or until lightly browned.</p><p class=""H1"">      Immediately sprinkle 1 cup of semi-sweet chocolate chips morsels over crust; drop peanut butter by spoonfuls onto morsels. Let stand for 5 minutes or until soft and shiny.  Gently spread chocolate and peanut butter over the crust. Top with fruit and candy. Cut into wedges. Serve warm. Makes 12 servings.</p></td></tr></tbody></table>"
"1522286092-2575","http://www.cookbooks.com/","Pizza","http://www.cookbooks.com/recipes-search.aspx?id=1&tag=pizza","18","http://www.cookbooks.com/recipes-search.aspx?page=18","262. BERRY PATCH BROWNIE PIZZA","http://www.cookbooks.com/Recipe-Details.aspx?id=29697","<p class=""H2""><font size=""5"">BERRY PATCH BROWNIE PIZZA</font><br><span class=""H2""><font size=""4""><i></i></font></span><br></p><hr><p class=""H3""><strong></strong></p><table width=""100%"" border=""1px"" cellspacing=""0"" cellpadding=""10""><tbody><tr><td><span class=""H2"">ingredients</span><br><p class=""H1"">1 (19.8 oz.)  pkg. fudge brownie mix<br>1/3  c. chopped unblanched almonds<br>1 (8 oz.)  pkg. cream cheese, softened<br>1  Tbsp. granulated sugar<br>1/2  tsp. vanilla<br>2  c. thawed frozen whipped topping<br>1  pt. fresh strawberries, divided<br>1/2  c. fresh raspberries<br>1/2  c. fresh blueberries<br>  grated peel of 1 lemon<br>  powdered sugar (for garnish)<br>  strawberry fan (for garnish)<br></p></td></tr></tbody></table><table width=""100%"" border=""1px"" cellspacing=""0"" cellpadding=""10""><tbody><tr><td><span class=""H2"">preparation</span><br><p class=""H1"">      Preheat oven to 375°. Prepare brownie mix according to package directions. Stir in almonds. Spread batter onto bottom of greased 14-inch pizza pan. Bake 18 to 20 minutes or until set. Cool completely.</p><p class=""H1"">      In a large bowl, combine cream cheese, sugar and vanilla; mix until smooth. Fold in whipped topping. Chop enough strawberries to measure 1/2 cup. Gently stir into cream cheese mixture. Spread strawberry mixture evenly onto brownies. Slice remaining strawberries. Arrange on brownie. Top with raspberries and blueberries. Sprinkle with peel. Garnish with powdered sugar and strawberry fan, if desired. Yield: 16 servings.</p></td></tr></tbody></table>"
"1522286538-2767","http://www.cookbooks.com/","Pizza","http://www.cookbooks.com/recipes-search.aspx?id=1&tag=pizza","5","http://www.cookbooks.com/recipes-search.aspx?page=5","70. GERMAN PIZZA","http://www.cookbooks.com/Recipe-Details.aspx?id=7657","<p class=""H2""><font size=""5"">GERMAN PIZZA</font><br><span class=""H2""><font size=""4""><i></i></font></span><br></p><hr><p class=""H3""><strong></strong></p><table width=""100%"" border=""1px"" cellspacing=""0"" cellpadding=""10""><tbody><tr><td><span class=""H2"">ingredients</span><br><p class=""H1"">1  lb. hamburger<br>1/2  medium onion, chopped<br>1/2  green pepper, chopped (optional)<br>1 1/2  tsp. salt, divided<br>1/2  tsp. pepper<br>2  Tbsp. butter<br>6  medium potatoes (about 2 1/4 lb.)<br>3  eggs, beaten<br>1/3  c. milk<br>2  c. shredded cheese<br></p></td></tr></tbody></table><table width=""100%"" border=""1px"" cellspacing=""0"" cellpadding=""10""><tbody><tr><td><span class=""H2"">preparation</span><br><p class=""H1"">      In a 12-inch stove-top skillet or electric skillet over medium heat, brown hamburger with  onion,  green  peppers, 1/2 teaspoon salt  and  pepper.  Melt  butter.  Spread  potatoes, (which have been peeled and finely  shredded)  over butter and sprinkle with remaining salt.  Top with meat mixture.  Combine eggs and milk; pour over all.  Cook,  covered,  until potatoes are tender, about 30 minutes.  Top with cheese; cover and heat until cheese is melted, about 5 minutes.  Cut  into  wedges or squares to serve.</p></td></tr></tbody></table>"
"1522286369-2696","http://www.cookbooks.com/","Pizza","http://www.cookbooks.com/recipes-search.aspx?id=1&tag=pizza","10","http://www.cookbooks.com/recipes-search.aspx?page=10","141. APPLE PIZZA","http://www.cookbooks.com/Recipe-Details.aspx?id=17434","<p class=""H2""><font size=""5"">APPLE PIZZA</font><br><span class=""H2""><font size=""4""><i></i></font></span><br></p><hr><p class=""H3""><strong></strong></p><table width=""100%"" border=""1px"" cellspacing=""0"" cellpadding=""10""><tbody><tr><td><span class=""H2"">ingredients</span><br><p class=""H1"">1  tube sugar cookie dough<br>1 (8 oz.)  pkg. cream cheese<br>1/2  c. packed brown sugar<br>1/3  c. caramel ice cream topping<br>2  to 3 apples<br></p></td></tr></tbody></table><table width=""100%"" border=""1px"" cellspacing=""0"" cellpadding=""10""><tbody><tr><td><span class=""H2"">preparation</span><br><p class=""H1"">      Spread sugar cookie dough on bottom of a 13-inch pizza pan or 9 x 13-inch cake pan.  Bake at 350° for 15 minutes or until lightly browned.  Cool.  Mix with a beater cream cheese, brown sugar and caramel ice cream topping; beat until smooth.  Spread on COLD crust.  Put apples, sliced thin in lemon juice and drain really well.  Arrange over caramel; sprinkle with mixed nuts or peanuts or a cinnamon/sugar mixture.  Refrigerate for awhile, then cut.</p></td></tr></tbody></table>"
