web-scraper-order,web-scraper-start-url,cat,cat-href,page,page-href,title,title-href,info
"1522286554-2773","http://www.cookbooks.com/","Pizza","http://www.cookbooks.com/recipes-search.aspx?id=1&tag=pizza","5","http://www.cookbooks.com/recipes-search.aspx?page=5","64. VEGETABLE PIZZA","http://www.cookbooks.com/Recipe-Details.aspx?id=7308","<p class=""H2""><font size=""5"">VEGETABLE PIZZA</font><br><span class=""H2""><font size=""4""><i></i></font></span><br></p><hr><p class=""H3""><strong></strong></p><table width=""100%"" border=""1px"" cellspacing=""0"" cellpadding=""10""><tbody><tr><td><span class=""H2"">ingredients</span><br><p class=""H1"">2 (8 count)  cans crescent biscuits<br>1  (16 oz.) container cottage cheese<br>1/2  c. mayonnaise<br>1  pkg. Hidden Valley Ranch salad dressing<br>  finely chopped vegetables<br>  finely chopped meats<br>  finely chopped cheese<br></p></td></tr></tbody></table><table width=""100%"" border=""1px"" cellspacing=""0"" cellpadding=""10""><tbody><tr><td><span class=""H2"">preparation</span><br><p class=""H1"">      Press crescent biscuits into and halfway up the sides of 15 1/2 x 10 1/2-inch jelly roll pan. Bake at room temperature given on biscuit can. Let cool. Blend Hidden Valley Ranch salad dressing mix until smooth, then spread on cooled crust. Put finely chopped vegetables, meat and cheese on top. You can use broccoli, cauliflower, fresh mushrooms, green onion, radishes, pepperoni, cooked sausage, ham and shredded cheese. Just use your imagination. Chill before serving.</p><p class=""H1"">      This recipe can be halved and you use a 9 1/4 x 13 1/4-inch jelly roll pan.</p></td></tr></tbody></table>"
"1522286659-2817","http://www.cookbooks.com/","Pizza","http://www.cookbooks.com/recipes-search.aspx?id=1&tag=pizza","2","http://www.cookbooks.com/recipes-search.aspx?page=2","20. PARTY PIZZA","http://www.cookbooks.com/Recipe-Details.aspx?id=3046","<p class=""H2""><font size=""5"">PARTY PIZZA</font><br><span class=""H2""><font size=""4""><i></i></font></span><br></p><hr><p class=""H3""><strong></strong></p><table width=""100%"" border=""1px"" cellspacing=""0"" cellpadding=""10""><tbody><tr><td><span class=""H2"">ingredients</span><br><p class=""H1"">2  lb. mild sausage<br>1  lb. hot sausage<br>2  lb. Velveeta cheese<br>1  large onion, diced<br>2  green peppers, diced<br>1  tsp. oregano<br>1  tsp. fennel (not required)<br></p></td></tr></tbody></table><table width=""100%"" border=""1px"" cellspacing=""0"" cellpadding=""10""><tbody><tr><td><span class=""H2"">preparation</span><br><p class=""H1"">      Scramble and brown sausage.  Drain.  Melt cheese in double boiler.  Sauté onion and green pepper.  Drain.  Add sausage, green pepper and onion to cheese.  Spread on party rye bread.  Bake 10 minutes at 350°.  This makes enough for 2 loaves of bread.</p></td></tr></tbody></table>"
"1522286332-2679","http://www.cookbooks.com/","Pizza","http://www.cookbooks.com/recipes-search.aspx?id=1&tag=pizza","11","http://www.cookbooks.com/recipes-search.aspx?page=11","158. VEGETABLE PIZZA-FINGER SALAD","http://www.cookbooks.com/Recipe-Details.aspx?id=18924","<p class=""H2""><font size=""5"">VEGETABLE PIZZA-FINGER SALAD</font><br><span class=""H2""><font size=""4""><i></i></font></span><br></p><hr><p class=""H3""><strong></strong></p><table width=""100%"" border=""1px"" cellspacing=""0"" cellpadding=""10""><tbody><tr><td><span class=""H2"">ingredients</span><br><p class=""H1"">2  pkg. crescent dinner rolls<br>2  pkg. (8 oz.) cream cheese, softened<br>1  c. mayonnaise<br>1  pkg. original Hidden Valley dressing<br>1  c. green pepper, finely chopped<br>1  c. carrots, finely chopped<br>1  c. black olives, sliced<br>1  c. Cheddar cheese, shredded<br></p></td></tr></tbody></table><table width=""100%"" border=""1px"" cellspacing=""0"" cellpadding=""10""><tbody><tr><td><span class=""H2"">preparation</span><br><p class=""H1"">      Unwrap rolls and lay flat in jelly roll pan to form crust. Bake crust at 350° for 10 minutes.  Allow to cool.  Mix cream cheese, mayo and Hidden Valley dressing with electric mixer.  When smooth, spread over cooled crust.  Sprinkle vegetables, cheese and olives over cream cheese layer and cut into squares.</p></td></tr></tbody></table>"
"1522286288-2660","http://www.cookbooks.com/","Pizza","http://www.cookbooks.com/recipes-search.aspx?id=1&tag=pizza","12","http://www.cookbooks.com/recipes-search.aspx?page=12","177. QUICK PIZZA DIP","http://www.cookbooks.com/Recipe-Details.aspx?id=19683","<p class=""H2""><font size=""5"">QUICK PIZZA DIP</font><br><span class=""H2""><font size=""4""><i></i></font></span><br></p><hr><p class=""H3""><strong></strong></p><table width=""100%"" border=""1px"" cellspacing=""0"" cellpadding=""10""><tbody><tr><td><span class=""H2"">ingredients</span><br><p class=""H1"">1 (8 oz.)  pkg. Philadelphia cream cheese, softened<br>1  c. Kraft 100% grated Parmesan cheese, divided<br>1/2  c. pizza sauce<br>1/2  c. Kraft shredded Mozzarella cheese<br>2  Tbsp. chopped green pepper<br>2  Tbsp. chopped red pepper<br></p></td></tr></tbody></table><table width=""100%"" border=""1px"" cellspacing=""0"" cellpadding=""10""><tbody><tr><td><span class=""H2"">preparation</span><br><p class=""H1"">      Mix cream cheese and 1/2 cup of the Parmesan cheese with the electric mixer on medium speed until well blended.  Spread on bottom of 9-inch pie plate.  Top with pizza sauce, Mozzarella cheese, remaining 1/2 cup Parmesan cheese and peppers.  Bake at 350° for 20 minutes or until thoroughly heated.  Serve with assorted Nabisco crackers or Stella D'Oro breadsticks.</p></td></tr></tbody></table>"
"1522286006-2538","http://www.cookbooks.com/","Pizza","http://www.cookbooks.com/recipes-search.aspx?id=1&tag=pizza","20","http://www.cookbooks.com/recipes-search.aspx?page=20","299. VEGETABLE PIZZA","http://www.cookbooks.com/Recipe-Details.aspx?id=34196","<p class=""H2""><font size=""5"">VEGETABLE PIZZA</font><br><span class=""H2""><font size=""4""><i></i></font></span><br></p><hr><p class=""H3""><strong></strong></p><table width=""100%"" border=""1px"" cellspacing=""0"" cellpadding=""10""><tbody><tr><td><span class=""H2"">ingredients</span><br><p class=""H1"">1 (8 oz.)  pkg. cream cheese<br>1 small  pkg. Hidden Valley Ranch dressing mix<br>2  cans Pillsbury crescent rolls<br>3/4  c. mayonnaise<br>  assorted vegetables (tomatoes, olives, celery, onions, broccoli, cauliflower, carrots, mushrooms), chopped<br></p></td></tr></tbody></table><table width=""100%"" border=""1px"" cellspacing=""0"" cellpadding=""10""><tbody><tr><td><span class=""H2"">preparation</span><br><p class=""H1"">      On a cookie sheet with sides, spread pieces of crescent roll dough. Pinch seams together to make complete crust. Bake at 400° as per package directions. Mix together cream cheese, dressing mix and mayonnaise. Spread on cooled crust. Top with assorted chopped vegetables.</p></td></tr></tbody></table>"
"1522286230-2636","http://www.cookbooks.com/","Pizza","http://www.cookbooks.com/recipes-search.aspx?id=1&tag=pizza","14","http://www.cookbooks.com/recipes-search.aspx?page=14","201. PIZZA LOAF","http://www.cookbooks.com/Recipe-Details.aspx?id=22582","<p class=""H2""><font size=""5"">PIZZA LOAF</font><br><span class=""H2""><font size=""4""><i></i></font></span><br></p><hr><p class=""H3""><strong></strong></p><table width=""100%"" border=""1px"" cellspacing=""0"" cellpadding=""10""><tbody><tr><td><span class=""H2"">ingredients</span><br><p class=""H1"">1  1lb. loaf frozen bread dough (thawed)<br>1  lb. hamburger<br>1/4  c. sliced mushrooms<br>1  medium chopped onion<br>1  tsp. salt<br>1/4  tsp. pepper<br>2  Tbsp. melted butter<br>1  tsp. paprika<br>1/2  tsp. oregano<br>1/2  tsp. garlic salt<br>1 8  oz. can tomato sauce<br>1  c. shredded cheddar cheese<br>3/4  c. shredded mozzarella cheese<br></p></td></tr></tbody></table><table width=""100%"" border=""1px"" cellspacing=""0"" cellpadding=""10""><tbody><tr><td><span class=""H2"">preparation</span><br><p class=""H1"">      Let bread dough rise.  Prepare filling:  Cook meat with onions, mushrooms, salt and pepper in large skillet.  Drain.  Stir in tomato sauce, paprika, oregano and garlic salt.  Bring to a boil, lower heat, cover and simmer 30 minutes, stirring occasionally. Cool. punch down dough.  Press out onto a 15 x 12 greased cookie sheet.  Spoon meat filling down center third of dough.  Sprinkle cheeses on filling.  Make diagonal cuts in dough, 1 1/2 inches apart down each side, to within 1/2 inch of filling.  Criss cross srtips over filling, pressing down and sealing with a drop of water.  Brush top of loaf with melted butter.  Bake at 350° for 30 minutes or until golden brown.  Cut in thick slices to serve. Serves 6.</p></td></tr></tbody></table>"
"1522286396-2708","http://www.cookbooks.com/","Pizza","http://www.cookbooks.com/recipes-search.aspx?id=1&tag=pizza","9","http://www.cookbooks.com/recipes-search.aspx?page=9","129. FRUIT PIZZA","http://www.cookbooks.com/Recipe-Details.aspx?id=14321","<p class=""H2""><font size=""5"">FRUIT PIZZA</font><br><span class=""H2""><font size=""4""><i></i></font></span><br></p><hr><p class=""H3""><strong></strong></p><table width=""100%"" border=""1px"" cellspacing=""0"" cellpadding=""10""><tbody><tr><td><span class=""H2"">ingredients</span><br><p class=""H1"">1 (20 oz.)  pkg. refrigerated sugar cookies<br>1 (8 oz.)  pkg. cream cheese, softened<br>1/3  c. sugar<br>1/2  tsp. vanilla<br>  banana slices<br>  peeled kiwi slices<br>  strawberry halves<br>  blueberries<br>1/2  c. orange marmalade, peach or apricot preserves<br>2  Tbsp. water<br></p></td></tr></tbody></table><table width=""100%"" border=""1px"" cellspacing=""0"" cellpadding=""10""><tbody><tr><td><span class=""H2"">preparation</span><br><p class=""H1"">      Freeze cookie dough 1 hour.  Slice into 1/8-inch slices. Line foil-lined 14-inch pizza pan with slices, overlapping edges slightly.  Bake at 375° for 12 minutes or until golden brown. Cool.  Invert onto serving plate; carefully remove foil.  Invert to right side.</p><p class=""H1"">      Combine cream cheese, sugar and vanilla, mixing until well blended.  Spread over crust.  Arrange fruit over cream cheese layer.  Glaze with combined marmalade and water; chill.  Cut into wedges.  Makes 10 to 12 servings.</p><p class=""H1"">      Variations:  Substitute one or more of the following for the banana, kiwi, strawberries, blueberries, raspberries, red or green grape halves, pineapple chunks, maraschino cherry halves (drained), thin sliced peaches, pears or apples or Mandarin orange segments (drained).</p></td></tr></tbody></table>"
"1522286419-2718","http://www.cookbooks.com/","Pizza","http://www.cookbooks.com/recipes-search.aspx?id=1&tag=pizza","8","http://www.cookbooks.com/recipes-search.aspx?page=8","119. FRUIT PIZZA","http://www.cookbooks.com/Recipe-Details.aspx?id=12528","<p class=""H1"">Could NOT Open Recipe Page Due To:</p>Conversion from type 'DBNull' to type 'String' is not valid."
"1522286355-2689","http://www.cookbooks.com/","Pizza","http://www.cookbooks.com/recipes-search.aspx?id=1&tag=pizza","10","http://www.cookbooks.com/recipes-search.aspx?page=10","148. BANANA BERRY BROWNIE PIZZA","http://www.cookbooks.com/Recipe-Details.aspx?id=18189","<p class=""H2""><font size=""5"">BANANA BERRY BROWNIE PIZZA</font><br><span class=""H2""><font size=""4""><i></i></font></span><br></p><hr><p class=""H3""><strong></strong></p><table width=""100%"" border=""1px"" cellspacing=""0"" cellpadding=""10""><tbody><tr><td><span class=""H2"">ingredients</span><br><p class=""H1"">1/3  c. water<br>1 (15 oz.)  pkg. brownie mix<br>1/4  c. oil<br>1  egg<br></p></td></tr></tbody></table><table width=""100%"" border=""1px"" cellspacing=""0"" cellpadding=""10""><tbody><tr><td><span class=""H2"">preparation</span><br><p class=""H1"">	Preheat oven to 350°.  Bring water to boil. Mix together brownie mix, water, oil and egg in large bowl until well blended. Pour into greased and floured 12-inch pizza pan. Bake 25 minutes.</p></td></tr></tbody></table><p class=""H3""><strong>Topping:</strong></p><table width=""100%"" border=""1px"" cellspacing=""0"" cellpadding=""10""><tbody><tr><td><span class=""H2"">ingredients</span><br><p class=""H1"">1 (8 oz.)  pkg. cream cheese, softened<br>1/4  c. sugar<br>1  egg<br>1  tsp. vanilla<br>  strawberry slices<br>  banana slices<br>1 (1 oz.)  sq. semi-sweet chocolate, melted<br></p></td></tr></tbody></table><table width=""100%"" border=""1px"" cellspacing=""0"" cellpadding=""10""><tbody><tr><td><span class=""H2"">preparation</span><br><p class=""H1"">	Beat cream cheese, sugar, egg and vanilla in small mixing bowl until well blended. Pour over crust.  Bake 15 minutes.  Cool. Top with fruit; drizzle with chocolate. Garnish with mint leaves, if desired.  Makes 10 to 12 servings.</p></td></tr></tbody></table>"
"1522286361-2692","http://www.cookbooks.com/","Pizza","http://www.cookbooks.com/recipes-search.aspx?id=1&tag=pizza","10","http://www.cookbooks.com/recipes-search.aspx?page=10","145. POCKET PIZZA","http://www.cookbooks.com/Recipe-Details.aspx?id=17640","<p class=""H2""><font size=""5"">POCKET PIZZA</font><br><span class=""H2""><font size=""4""><i></i></font></span><br></p><hr><p class=""H3""><strong></strong></p><table width=""100%"" border=""1px"" cellspacing=""0"" cellpadding=""10""><tbody><tr><td><span class=""H2"">ingredients</span><br><p class=""H1"">  Pizza Dough (below)<br>1  Tbsp. vegetable oil<br>1/4  c. pizza sauce<br>1/2  c. each shredded Mozzarella cheese and cooked Italian sausage<br>1  Tbsp. finely chopped onion<br>1/8 to 1/4  tsp. garlic powder<br>1/4  pkg. (3 oz. size) sliced pepperoni<br>2 to 3  Tbsp. pizza sauce<br>1/2  c. shredded Mozzarella cheese<br></p></td></tr></tbody></table><table width=""100%"" border=""1px"" cellspacing=""0"" cellpadding=""10""><tbody><tr><td><span class=""H2"">preparation</span><br><p class=""H1"">      Heat the oven to 425°. Lightly grease a cookie sheet with shortening.</p><p class=""H1"">       Prepare Pizza Dough. Roll into a 12-inch circle. Fold loosely in half; place on cookie sheet and unfold. Brush with oil.</p><p class=""H1"">      Layer remaining ingredients on half of the circle in order listed; fold dough over filling. Turn edge of the lower dough over edge of the top dough; pinch edge to seal. Prick top with a fork. Bake until golden brown, 20 to 25 minutes.</p></td></tr></tbody></table><p class=""H3""><strong>Pizza Dough:</strong></p><table width=""100%"" border=""1px"" cellspacing=""0"" cellpadding=""10""><tbody><tr><td><span class=""H2"">ingredients</span><br><p class=""H1"">1  c. Gold Medal all-purpose flour<br>1/3  c. milk<br>2  Tbsp. vegetable oil<br>1  tsp. baking powder<br>1/2  tsp. salt<br></p></td></tr></tbody></table><table width=""100%"" border=""1px"" cellspacing=""0"" cellpadding=""10""><tbody><tr><td><span class=""H2"">preparation</span><br><p class=""H1"">      Beat the flour, milk, oil, baking powder and salt in a bowl until the dough leaves side. Turn onto a lightly floured surface; gather into a ball. Knead 10 times. Cover with a bowl; let stand 15 minutes.</p></td></tr></tbody></table>"
"1522286351-2687","http://www.cookbooks.com/","Pizza","http://www.cookbooks.com/recipes-search.aspx?id=1&tag=pizza","10","http://www.cookbooks.com/recipes-search.aspx?page=10","150. PIZZA SWIRLS","http://www.cookbooks.com/Recipe-Details.aspx?id=18638","<p class=""H2""><font size=""5"">PIZZA SWIRLS</font><br><span class=""H2""><font size=""4""><i></i></font></span><br></p><hr><p class=""H3""><strong></strong></p><table width=""100%"" border=""1px"" cellspacing=""0"" cellpadding=""10""><tbody><tr><td><span class=""H2"">ingredients</span><br><p class=""H1"">1  (1 lb.) loaf frozen bread dough, thawed<br>1/4  c. prepared pasta sauce<br>1/2  c. shredded Mozzarella<br>2  Tbsp. finely chopped pepperoni<br>1  Tbsp. olive oil<br>2  Tbsp. grated Parmesan<br></p></td></tr></tbody></table><table width=""100%"" border=""1px"" cellspacing=""0"" cellpadding=""10""><tbody><tr><td><span class=""H2"">preparation</span><br><p class=""H1"">	Preheat oven to 450°. Generously coat a rimmed baking sheet with cooking spray. Roll out dough to a 10-inch square on a floured surface. Spread pasta sauce over dough. Reserve 2 tablespoons Mozzarella; sprinkle remaining Mozzarella over sauce. Top with pepperoni. Roll dough jelly roll style to enclose filling. Cut roll crosswise into 10 slices. Place slices, cut side down, on prepared baking sheet. Brush tops with oil. Sprinkle with Parmesan and reserved Mozzarella. Bake until golden brown, about 15 minutes. Transfer to a serving platter and serve immediately.</p></td></tr></tbody></table>"
"1522286602-2792","http://www.cookbooks.com/","Pizza","http://www.cookbooks.com/recipes-search.aspx?id=1&tag=pizza","3","http://www.cookbooks.com/recipes-search.aspx?page=3","45. HOMEMADE PIZZA SAUCE","http://www.cookbooks.com/Recipe-Details.aspx?id=5062","<p class=""H2""><font size=""5"">HOMEMADE PIZZA SAUCE</font><br><span class=""H2""><font size=""4""><i></i></font></span><br></p><hr><p class=""H3""><strong></strong></p><table width=""100%"" border=""1px"" cellspacing=""0"" cellpadding=""10""><tbody><tr><td><span class=""H2"">ingredients</span><br><p class=""H1"">1/2  bushel tomatoes (26 lb.)<br>6 garlic cloves, chopped or 3/4  tsp. garlic powder<br>6  medium onions, chopped<br>1  c. chopped parsley<br>1/2  c. brown sugar<br>1/4  c. salt<br>3  Tbsp. oregano<br>2  Tbsp. basil<br>1  Tbsp. pepper<br></p></td></tr></tbody></table><table width=""100%"" border=""1px"" cellspacing=""0"" cellpadding=""10""><tbody><tr><td><span class=""H2"">preparation</span><br><p class=""H1"">      Cook  tomatoes, onions, garlic and fresh parsley.  Then run through ricer.  Return to kettle and add remaining ingredients. Cook  to  desired thickness, about 4 hours.  Good for spaghetti too.</p></td></tr></tbody></table>"
"1522286017-2543","http://www.cookbooks.com/","Pizza","http://www.cookbooks.com/recipes-search.aspx?id=1&tag=pizza","20","http://www.cookbooks.com/recipes-search.aspx?page=20","294. VEGGIE PIZZA","http://www.cookbooks.com/Recipe-Details.aspx?id=33554","<p class=""H2""><font size=""5"">VEGGIE PIZZA</font><br><span class=""H2""><font size=""4""><i></i></font></span><br></p><hr><p class=""H3""><strong></strong></p><table width=""100%"" border=""1px"" cellspacing=""0"" cellpadding=""10""><tbody><tr><td><span class=""H2"">ingredients</span><br><p class=""H1"">2  pkg. crescent rolls<br>16  oz. soft cream cheese<br>1  c. mayo<br>1 1/2  pkg. dry ranch dressing<br>  assorted chopped vegetables<br>  shredded Cheddar<br></p></td></tr></tbody></table><table width=""100%"" border=""1px"" cellspacing=""0"" cellpadding=""10""><tbody><tr><td><span class=""H2"">preparation</span><br><p class=""H1"">      Place rolls on cookie sheet and press seams together.  Bake at 350 degrees for 15 minutes.  Mix cream cheese, mayo and dressing; spread over cooled crust.  Add chopped veggies and cheese.  Cut into squares.</p></td></tr></tbody></table>"
"1522286566-2777","http://www.cookbooks.com/","Pizza","http://www.cookbooks.com/recipes-search.aspx?id=1&tag=pizza","4","http://www.cookbooks.com/recipes-search.aspx?page=4","60. PASTA PIZZA","http://www.cookbooks.com/Recipe-Details.aspx?id=7135","<p class=""H2""><font size=""5"">PASTA PIZZA</font><br><span class=""H2""><font size=""4""><i></i></font></span><br></p><hr><p class=""H3""><strong></strong></p><table width=""100%"" border=""1px"" cellspacing=""0"" cellpadding=""10""><tbody><tr><td><span class=""H2"">ingredients</span><br><p class=""H1"">2  c uncooked macaroni<br>3  eggs, beaten<br>1/2  c milk<br>1/2  c cheddar cheese, shredded<br>1/4  c onion, finely chopped<br>1/2  tsp salt<br>1/4  tsp black pepper<br>1  lb ground beef, lean<br>14  oz spaghetti sauce<br>1  medium tomato, thinly sliced<br>1  green pepper, sliced into rings<br>1-1/2  c shredded mozzarella cheese<br></p></td></tr></tbody></table><table width=""100%"" border=""1px"" cellspacing=""0"" cellpadding=""10""><tbody><tr><td><span class=""H2"">preparation</span><br><p class=""H1"">      Cook macaroni according to package directions.  Drain. Combine eggs and milk and stir into cooked macaroni.  Stir in cheddar cheese, onion, salt and pepper.  Mix well.  Spread mixture evenly over a buttered 14 inch pizza pan.  Bake at 350° for 20 minutes.</p><p class=""H1"">      Meanwhile, in a large skillet, cook ground beef until browned. Drain off fat.  Stir in spaghetti sauce.  Spoon meat mixture over baked macaroni crust.  Arrange tomato slices and pepper rings on pizza.  Sprinkle with mozzarella cheese.  Bake for additional 15 minutes or until cheese is bubbly.</p><p class=""H1"">      Makes 8 servings.</p></td></tr></tbody></table>"
"1522286526-2762","http://www.cookbooks.com/","Pizza","http://www.cookbooks.com/recipes-search.aspx?id=1&tag=pizza","5","http://www.cookbooks.com/recipes-search.aspx?page=5","75. POUR PIZZA","http://www.cookbooks.com/Recipe-Details.aspx?id=7684","<p class=""H2""><font size=""5"">POUR PIZZA</font><br><span class=""H2""><font size=""4""><i></i></font></span><br></p><hr><p class=""H3""><strong></strong></p><table width=""100%"" border=""1px"" cellspacing=""0"" cellpadding=""10""><tbody><tr><td><span class=""H2"">ingredients</span><br><p class=""H1"">1  lb. hamburger<br>1  onion, chopped<br>1  c. flour<br>1  tsp. salt<br>1/8  tsp. pepper<br>1/8  tsp. oregano<br>2  eggs<br>2/3  c. milk<br>1 (15 oz.)  can pizza sauce (pt.)<br>1 1/2 to 2  c. grated cheese<br></p></td></tr></tbody></table><table width=""100%"" border=""1px"" cellspacing=""0"" cellpadding=""10""><tbody><tr><td><span class=""H2"">preparation</span><br><p class=""H1"">      Preheat  oven  to  400°.  Brown  hamburger  and  onion. Season with salt and pepper.  Set aside.  Combine flour, salt, pepper, oregano, eggs and milk, making  a soft batter.  Grease a 9 x 13-inch pan.  Sprinkle with  cornmeal.  Pour  batter  in pan. Sprinkle  meat over batter.  Bake  15  to  20  minutes. Spread pizza sauce and cheese over meat.  Bake  15  more  minutes. Yields 1 (9 x 13-inch) pan.</p></td></tr></tbody></table>"
"1522286032-2549","http://www.cookbooks.com/","Pizza","http://www.cookbooks.com/recipes-search.aspx?id=1&tag=pizza","20","http://www.cookbooks.com/recipes-search.aspx?page=20","288. BARBECUE CHICKEN PIZZA","http://www.cookbooks.com/Recipe-Details.aspx?id=33356","<p class=""H2""><font size=""5"">BARBECUE CHICKEN PIZZA</font><br><span class=""H2""><font size=""4""><i></i></font></span><br></p><table width=""100%"" border=""0"" cellspacing=""2"" cellpending=""5""><tbody><tr><td valign=""top""><p class=""H2""><img src=""images-new/recipe-categories/pizza-grilled-chicken.jpg"" alt=""BARBECUE CHICKEN PIZZA"" border=""0"" width=""200""></p></td><td valign=""middle""><p class=""H1""></p></td></tr></tbody></table><hr><p class=""H3""><strong></strong></p><table width=""100%"" border=""1px"" cellspacing=""0"" cellpadding=""10""><tbody><tr><td><span class=""H2"">ingredients</span><br><p class=""H1"">2  c. chopped cooked chicken<br>3/4  c. barbecue sauce<br>1  pkg. (14 oz) prebaked Italian pizza crust<br>1  c. (4 oz) shredded mozzarella cheese<br>1/4  medium size red onion, thinly sliced<br>2  green onions, chopped<br></p></td></tr></tbody></table><table width=""100%"" border=""1px"" cellspacing=""0"" cellpadding=""10""><tbody><tr><td><span class=""H2"">preparation</span><br><p class=""H1"">      Combine chicken and barbecue sauce.  Place pizza crust on a baking sheet.  Spread chicken mixture over pizza crust.  Top with remaining ingredients.  Bake at 450° for 15 minutes or until cheese melts.</p></td></tr></tbody></table>"
"1522286311-2670","http://www.cookbooks.com/","Pizza","http://www.cookbooks.com/recipes-search.aspx?id=1&tag=pizza","12","http://www.cookbooks.com/recipes-search.aspx?page=12","167. HOT PIZZA DIP","http://www.cookbooks.com/Recipe-Details.aspx?id=19304","<p class=""H2""><font size=""5"">HOT PIZZA DIP</font><br><span class=""H2""><font size=""4""><i></i></font></span><br></p><hr><p class=""H3""><strong></strong></p><table width=""100%"" border=""1px"" cellspacing=""0"" cellpadding=""10""><tbody><tr><td><span class=""H2"">ingredients</span><br><p class=""H1"">8  oz. cream cheese, softened<br>1  tsp. Italian seasoning<br>1  c. shredded Mozzarella cheese<br>2  Tbsp. sliced green onions<br>3/4  c. Parmesan cheese<br>8  oz. pizza sauce<br>2  Tbsp. chopped green pepper<br>  piping hot loaf bread, baked in bread tube or tortilla chips<br></p></td></tr></tbody></table><table width=""100%"" border=""1px"" cellspacing=""0"" cellpadding=""10""><tbody><tr><td><span class=""H2"">preparation</span><br><p class=""H1"">      Preheat oven to 350°.  Combine cream cheese and Italian seasoning; mix well.  Spread in bottom of 9-inch round cake pan. Combine cheeses.  Sprinkle half of cheese mixture over cream cheese.  Spread pizza sauce over cheese.  Top with remaining cheese, peppers and onions.</p><p class=""H1"">      Bake 15 to 18 minutes or until cheese is melted and mixture is bubbling around the edges.  Serve hot with bread or chips.</p></td></tr></tbody></table>"
