web-scraper-order,web-scraper-start-url,cat,cat-href,page,page-href,title,title-href,info
"1522282528-1374","http://www.cookbooks.com/","Soup","http://www.cookbooks.com/recipes-search.aspx?id=1&tag=Soup","3","http://www.cookbooks.com/recipes-search.aspx?page=3","38. CURRIED PUMPKIN SOUP","http://www.cookbooks.com/Recipe-Details.aspx?id=973","<p class=""H2""><font size=""5"">CURRIED PUMPKIN SOUP</font><br><span class=""H2""><font size=""4""><i></i></font></span><br></p><hr><p class=""H3""><strong></strong></p><table width=""100%"" border=""1px"" cellspacing=""0"" cellpadding=""10""><tbody><tr><td><span class=""H2"">ingredients</span><br><p class=""H1"">4  Tbsp. unsalted butter<br>1  large (8 oz.) onion, chopped<br>1  medium leek (white part only), cleaned and chopped<br>1  lb. pumpkin puree (canned or fresh)<br>4  c. chicken broth<br>1  tsp. salt<br>1/2  tsp. curry powder<br>1/4  tsp. nutmeg<br>1/4  tsp. white pepper<br>1/4  tsp. ginger<br>1  bay leaf<br>1  c. half and half<br>  chopped chives (for garnish)<br></p></td></tr></tbody></table><table width=""100%"" border=""1px"" cellspacing=""0"" cellpadding=""10""><tbody><tr><td><span class=""H2"">preparation</span><br><p class=""H1"">      Melt butter in 3-quart saucepan over moderate heat.  Add onion and leek; sauté, stirring often, until soft, about 8 minutes.  Stir in pumpkin, chicken broth and spices.  Bring to a boil, stirring; reduce the heat and simmer, uncovered, for 15 minutes.  Remove bay leaf.  Process in blender or food processor in batches.  (May be refrigerated for 2 days or frozen, puree only.)</p><p class=""H1"">      Return puree to saucepan; add half and half.  Stir over moderate heat until heated through.  Adjust seasoning and garnish with chives.</p></td></tr></tbody></table>"
"1522282119-1192","http://www.cookbooks.com/","Soup","http://www.cookbooks.com/recipes-search.aspx?id=1&tag=Soup","15","http://www.cookbooks.com/recipes-search.aspx?page=15","220. MUSHROOM BARLEY SOUP","http://www.cookbooks.com/Recipe-Details.aspx?id=4671","<p class=""H2""><font size=""5"">MUSHROOM BARLEY SOUP</font><br><span class=""H2""><font size=""4""><i></i></font></span><br></p><hr><p class=""H3""><strong></strong></p><table width=""100%"" border=""1px"" cellspacing=""0"" cellpadding=""10""><tbody><tr><td><span class=""H2"">ingredients</span><br><p class=""H1"">  Chicken  Bouillon cubes<br>  Mushrooms<br>  Carrots<br>  Onion<br>  Barley<br>  Salt<br>  Pepper<br>  Chili Powder<br>  Roux<br></p></td></tr></tbody></table><table width=""100%"" border=""1px"" cellspacing=""0"" cellpadding=""10""><tbody><tr><td><span class=""H2"">preparation</span><br><p class=""H1"">      Boil water (once boiled), add bouillon cubes, carrots and onion (chopped small) add barley.  Cook until soft, add mushrooms. Make a roux, melt butter, add flour, stir in cold cream or milk and then stir until thick.  Once roux is finished combine vegetables and broth with the roux.  Add salt, pepper and chili powder to taste.</p></td></tr></tbody></table>"
"1522282429-1330","http://www.cookbooks.com/","Soup","http://www.cookbooks.com/recipes-search.aspx?id=1&tag=Soup","6","http://www.cookbooks.com/recipes-search.aspx?page=6","82. FISH SOUP WITH STUFFED PASTA","http://www.cookbooks.com/Recipe-Details.aspx?id=1042","<p class=""H2""><font size=""5"">FISH SOUP WITH STUFFED PASTA</font><br><span class=""H2""><font size=""4""><i></i></font></span><br></p><hr><p class=""H3""><strong></strong></p><table width=""100%"" border=""1px"" cellspacing=""0"" cellpadding=""10""><tbody><tr><td><span class=""H2"">ingredients</span><br><p class=""H1"">1  large onion, chopped<br>1  stalk celery, chopped<br>2  cloves garlic, pressed<br>3  Tbsp. oil<br>  pinch of dried red pepper<br>  salt to taste<br>1/4  tsp. sage<br>2  cans chicken broth<br>1 large (24 oz.)  can tomatoes with basil<br>1 1/2  lb. red snapper, cut in 1-inch pieces<br>1  pkg. cheese ravioli (7 oz.)<br>1/2  lb. small shrimp<br>1  c. white wine or water<br>1/2  c. fresh parsley<br></p></td></tr></tbody></table><table width=""100%"" border=""1px"" cellspacing=""0"" cellpadding=""10""><tbody><tr><td><span class=""H2"">preparation</span><br><p class=""H1"">      Brown onion, celery and garlic in oil.  Add next 5 ingredients. Cook covered 1/2 hour.  (This part can be made ahead and refrigerated.)  Bring to a boil.  Add fish and cook 5 minutes. Cook ravioli.  Add to soup with shrimp, wine and parsley.  Serve hot.</p></td></tr></tbody></table>"
"1522282265-1257","http://www.cookbooks.com/","Soup","http://www.cookbooks.com/recipes-search.aspx?id=1&tag=Soup","11","http://www.cookbooks.com/recipes-search.aspx?page=11","155. RAFFERTY'S POTATO SOUP","http://www.cookbooks.com/Recipe-Details.aspx?id=4382","<p class=""H2""><font size=""5"">RAFFERTY'S POTATO SOUP</font><br><span class=""H2""><font size=""4""><i></i></font></span><br></p><hr><p class=""H3""><strong></strong></p><table width=""100%"" border=""1px"" cellspacing=""0"" cellpadding=""10""><tbody><tr><td><span class=""H2"">ingredients</span><br><p class=""H1"">6  to 7 medium potatoes, peeled and diced<br>1  medium onion, chopped fine<br>1 (8 oz.)  pkg. cream cheese<br>1/2  stick butter<br>1  can cream of mushroom soup<br>1  can cream of celery soup<br>1 1/2  c. or more milk<br>1  tsp. garlic salt<br>  salt and pepper to taste<br></p></td></tr></tbody></table><table width=""100%"" border=""1px"" cellspacing=""0"" cellpadding=""10""><tbody><tr><td><span class=""H2"">preparation</span><br><p class=""H1"">      In a large saucepan, cook potatoes and onion in water until tender.  Remove from heat.  Add cream cheese until melted.  Add rest of ingredients and serve hot.</p></td></tr></tbody></table>"
"1522282354-1297","http://www.cookbooks.com/","Soup","http://www.cookbooks.com/recipes-search.aspx?id=1&tag=Soup","8","http://www.cookbooks.com/recipes-search.aspx?page=8","115. SOUP A L'OIGNON MAISON","http://www.cookbooks.com/Recipe-Details.aspx?id=1839","<p class=""H2""><font size=""5"">SOUP A L'OIGNON MAISON</font><br><span class=""H2""><font size=""4""><i>(Onion Soup)  </i></font></span><br></p><hr><p class=""H3""><strong></strong></p><table width=""100%"" border=""1px"" cellspacing=""0"" cellpadding=""10""><tbody><tr><td><span class=""H2"">ingredients</span><br><p class=""H1"">3  Tbsp. butter<br>1  Tbsp. olive oil<br>1 1/2  lb. or 5 to 6 c. thin sliced yellow onions<br>1  tsp. salt<br>1/2  tsp. sugar<br>3  Tbsp. flour<br>2  qt. hot beef broth<br>1  c. red wine<br>1  bay leaf<br>1/2  tsp. sage<br></p></td></tr></tbody></table><table width=""100%"" border=""1px"" cellspacing=""0"" cellpadding=""10""><tbody><tr><td><span class=""H2"">preparation</span><br><p class=""H1"">      Melt butter and oil; add onion and stir.  Cover pan and cook on low heat 15 to 20 minutes until onions are tender.  Uncover, raise heat to medium-high; stir in salt and sugar.  Stir until sugar caramelizes.  Cook 30 minutes until onions are a dark brown.  Stir often.  Lower heat and stir in flour to make paste with onions. Cook slowly for 2 minutes.  Remove from heat.  Pour 1 cup hot broth, stirring with wire whip to blend flour.  Add rest of broth and ingredients.  Simmer 30 to 40 minutes.  Serve with French bread and Parmesan cheese.</p></td></tr></tbody></table>"
"1522282501-1362","http://www.cookbooks.com/","Soup","http://www.cookbooks.com/recipes-search.aspx?id=1&tag=Soup","4","http://www.cookbooks.com/recipes-search.aspx?page=4","50. CHEDDAR CHEESE VEGETABLE SOUP","http://www.cookbooks.com/Recipe-Details.aspx?id=985","<p class=""H2""><font size=""5"">CHEDDAR CHEESE VEGETABLE SOUP</font><br><span class=""H2""><font size=""4""><i></i></font></span><br></p><hr><p class=""H3""><strong></strong></p><table width=""100%"" border=""1px"" cellspacing=""0"" cellpadding=""10""><tbody><tr><td><span class=""H2"">ingredients</span><br><p class=""H1"">8  Tbsp. butter<br>1  c. pared, diced carrots<br>1/4  c. finely chopped onion<br>1  c. diced potatoes<br>1 (10 oz.)  pkg. frozen peas<br>5  Tbsp. flour<br>1 (10 oz.)  can chicken broth<br>4  c. grated Cheddar cheese<br>2  c. milk<br>1/4  tsp. salt<br>  dash of pepper<br>  croutons<br></p></td></tr></tbody></table><table width=""100%"" border=""1px"" cellspacing=""0"" cellpadding=""10""><tbody><tr><td><span class=""H2"">preparation</span><br><p class=""H1"">      In hot butter in 3-quart saucepan cook carrots, onion and potatoes, covered and stirring occasionally, about 25 minutes or until tender.  (Put carrots in first).  Add peas and remove from heat; stir in flour and mix well.  Cook 1 minute, stirring occasionally.  Add chicken broth.  Bring to boil, stirring constantly.  Gradually stir in cheese; cook over medium heat until cheese has melted.  Gradually add milk.  Season.  Bring to boil, but do not boil.  Serve with croutons.</p></td></tr></tbody></table>"
"1522282383-1310","http://www.cookbooks.com/","Soup","http://www.cookbooks.com/recipes-search.aspx?id=1&tag=Soup","7","http://www.cookbooks.com/recipes-search.aspx?page=7","102. POTATO SOUP","http://www.cookbooks.com/Recipe-Details.aspx?id=1279","<p class=""H2""><font size=""5"">POTATO SOUP</font><br><span class=""H2""><font size=""4""><i></i></font></span><br></p><hr><p class=""H3""><strong></strong></p><table width=""100%"" border=""1px"" cellspacing=""0"" cellpadding=""10""><tbody><tr><td><span class=""H2"">ingredients</span><br><p class=""H1"">1  Tbsp. soy margarine<br>4  medium potatoes<br>1  c. soy milk<br>1  medium zucchini, shredded<br>1/4  tsp. vegie-sal<br>1/2  c. parsley<br>1  medium onion, chopped<br>1 3/4  c. water<br>2  medium carrots, shredded<br>1/4  c. chopped green pepper<br>1/4  tsp. veggie pepper<br></p></td></tr></tbody></table><table width=""100%"" border=""1px"" cellspacing=""0"" cellpadding=""10""><tbody><tr><td><span class=""H2"">preparation</span><br><p class=""H1"">      Melt margarine.  Add onion.  Cook and stir.  Peel and dice potatoes.  Cook with onion 2 minutes.  Add water and bring to boil. Cook 10 minutes.  Remove half of potatoes and mash (blender).  Add milk.  Return to saucepan.  Add carrots, zucchini and green pepper. Simmer.  Stir in salt, pepper and parsley.  Cook until all vegetables are tender.</p></td></tr></tbody></table>"
"1522282104-1186","http://www.cookbooks.com/","Soup","http://www.cookbooks.com/recipes-search.aspx?id=1&tag=Soup","16","http://www.cookbooks.com/recipes-search.aspx?page=16","226. HAMBURG SOUP","http://www.cookbooks.com/Recipe-Details.aspx?id=4701","<p class=""H2""><font size=""5"">HAMBURG SOUP</font><br><span class=""H2""><font size=""4""><i></i></font></span><br></p><hr><p class=""H3""><strong></strong></p><table width=""100%"" border=""1px"" cellspacing=""0"" cellpadding=""10""><tbody><tr><td><span class=""H2"">ingredients</span><br><p class=""H1"">1 to 2  lb. hamburg<br>  potatoes<br>  onions (medium), chopped<br>  flour<br>  eggs<br></p></td></tr></tbody></table><table width=""100%"" border=""1px"" cellspacing=""0"" cellpadding=""10""><tbody><tr><td><span class=""H2"">preparation</span><br><p class=""H1"">      Boil hamburg with just enough water to cover.  When no longer pink, add diced potatoes and onions.  Cook, covered, on low heat until potatoes are tender. Mix flour and eggs; drop by spoonful into mixture.  Cover; cook on medium for 10 to 15 minutes.</p></td></tr></tbody></table>"
"1522282333-1288","http://www.cookbooks.com/","Soup","http://www.cookbooks.com/recipes-search.aspx?id=1&tag=Soup","9","http://www.cookbooks.com/recipes-search.aspx?page=9","124. MUSHROOM SOUP","http://www.cookbooks.com/Recipe-Details.aspx?id=2521","<p class=""H2""><font size=""5"">MUSHROOM SOUP</font><br><span class=""H2""><font size=""4""><i></i></font></span><br></p><hr><p class=""H3""><strong></strong></p><table width=""100%"" border=""1px"" cellspacing=""0"" cellpadding=""10""><tbody><tr><td><span class=""H2"">ingredients</span><br><p class=""H1"">1  qt. mushrooms<br>1 1/2  qt. good rich stock (veal or chicken)<br>1  Tbsp. flour<br>1  Tbsp. butter<br>1  tsp. salt<br>1/2  tsp. pepper<br>  whipped cream<br>  croutons<br></p></td></tr></tbody></table><table width=""100%"" border=""1px"" cellspacing=""0"" cellpadding=""10""><tbody><tr><td><span class=""H2"">preparation</span><br><p class=""H1"">      Wash and peel 1 quart mushrooms and dice.  Stir into them 1 1/2 quarts of good rich stock (veal or chicken).  Thicken with 1 tablespoon flour creamed with 1 tablespoon butter, 1 teaspoon salt and 1/2 teaspoon of pepper.  At the last moment, add a bit of whipped cream and croutons.</p></td></tr></tbody></table>"
"1522282493-1358","http://www.cookbooks.com/","Soup","http://www.cookbooks.com/recipes-search.aspx?id=1&tag=Soup","4","http://www.cookbooks.com/recipes-search.aspx?page=4","54. BUTTERNUT SQUASH AND APPLE SOUP","http://www.cookbooks.com/Recipe-Details.aspx?id=989","<p class=""H2""><font size=""5"">BUTTERNUT SQUASH AND APPLE SOUP</font><br><span class=""H2""><font size=""4""><i></i></font></span><br></p><hr><p class=""H3""><strong></strong></p><table width=""100%"" border=""1px"" cellspacing=""0"" cellpadding=""10""><tbody><tr><td><span class=""H2"">ingredients</span><br><p class=""H1"">1  small butternut squash (2 lb.)<br>3  tart apples<br>1  medium onion<br>1/4  tsp. rosemary<br>1/4  tsp. marjoram<br>3  cans chicken broth<br>2  cans water<br>2  slices white bread<br>1  tsp. salt<br>1/4  tsp. pepper<br>1/4  c. heavy cream<br>  chopped parsley (optional garnish)<br></p></td></tr></tbody></table><table width=""100%"" border=""1px"" cellspacing=""0"" cellpadding=""10""><tbody><tr><td><span class=""H2"">preparation</span><br><p class=""H1"">      Peel, seed and coarsely chop apples and squash.  Coarsely chop onion.  Combine first 10 ingredients in heavy saucepan.  Bring to a boil and simmer uncovered 45 minutes.  Cool soup a bit, then puree in blender.  Return soup to saucepan and bring to a boil.  Add cream and, if desired, sprinkle with chopped parsley.  Serves 6.</p></td></tr></tbody></table>"
"1522282109-1187","http://www.cookbooks.com/","Soup","http://www.cookbooks.com/recipes-search.aspx?id=1&tag=Soup","15","http://www.cookbooks.com/recipes-search.aspx?page=15","225. CREAMY CAULIFLOWER SOUP","http://www.cookbooks.com/Recipe-Details.aspx?id=4696","<p class=""H2""><font size=""5"">CREAMY CAULIFLOWER SOUP</font><br><span class=""H2""><font size=""4""><i></i></font></span><br></p><hr><p class=""H3""><strong></strong></p><table width=""100%"" border=""1px"" cellspacing=""0"" cellpadding=""10""><tbody><tr><td><span class=""H2"">ingredients</span><br><p class=""H1"">1  medium head cauliflower, broken into small pieces<br>1/4  c. chopped onions<br>1/4  c. butter<br>1/4  c. flour<br>3  c. chicken broth<br>2  c. milk<br>1  tsp. Worcestershire sauce<br>4  oz. shredded sharp cheese<br>  snipped chives<br></p></td></tr></tbody></table><table width=""100%"" border=""1px"" cellspacing=""0"" cellpadding=""10""><tbody><tr><td><span class=""H2"">preparation</span><br><p class=""H1"">      Cook cauliflower in saltwater 10 to 15 minutes; drain.  In saucepan, cook onion in butter until tender.  Blend in flour.  Add chicken broth, milk and Worcestershire sauce.  Cook until slightly thickened.  Add cauliflower.  Bring to boil; add cheese.  Sprinkle chives over each serving.</p></td></tr></tbody></table>"
"1522282439-1335","http://www.cookbooks.com/","Soup","http://www.cookbooks.com/recipes-search.aspx?id=1&tag=Soup","6","http://www.cookbooks.com/recipes-search.aspx?page=6","77. ALBONDIGAS SOUP","http://www.cookbooks.com/Recipe-Details.aspx?id=1037","<p class=""H1"">Could NOT Open Recipe Page Due To:</p>Conversion from type 'DBNull' to type 'String' is not valid."
"1522282136-1200","http://www.cookbooks.com/","Soup","http://www.cookbooks.com/recipes-search.aspx?id=1&tag=Soup","15","http://www.cookbooks.com/recipes-search.aspx?page=15","212. TUNA NOODLE SOUP","http://www.cookbooks.com/Recipe-Details.aspx?id=4649","<p class=""H2""><font size=""5"">TUNA NOODLE SOUP</font><br><span class=""H2""><font size=""4""><i></i></font></span><br></p><hr><p class=""H3""><strong></strong></p><table width=""100%"" border=""1px"" cellspacing=""0"" cellpadding=""10""><tbody><tr><td><span class=""H2"">ingredients</span><br><p class=""H1"">3  cans Campbell's Mushroom Soup<br>1  large bag egg noodles<br>3  cans of tuna (in water)<br>1  c milk<br>1  tbsp butter or margarine<br></p></td></tr></tbody></table><table width=""100%"" border=""1px"" cellspacing=""0"" cellpadding=""10""><tbody><tr><td><span class=""H2"">preparation</span><br><p class=""H1"">      Boil bag of egg noodles.  Drain. Mix milk, butter, soup and tuna in a  pan.  Heat on medium heat for 3 minutes or until it is at a slight boil, mixing as it heats. Add mixture to noodles. Serve hot.</p><p class=""H1"">      You can also add peas and serve on toast.</p></td></tr></tbody></table>"
"1522282147-1204","http://www.cookbooks.com/","Soup","http://www.cookbooks.com/recipes-search.aspx?id=1&tag=Soup","14","http://www.cookbooks.com/recipes-search.aspx?page=14","208. ITALIAN MEATBALL SOUP","http://www.cookbooks.com/Recipe-Details.aspx?id=4606","<p class=""H2""><font size=""5"">ITALIAN MEATBALL SOUP</font><br><span class=""H2""><font size=""4""><i></i></font></span><br></p><hr><p class=""H3""><strong></strong></p><table width=""100%"" border=""1px"" cellspacing=""0"" cellpadding=""10""><tbody><tr><td><span class=""H2"">ingredients</span><br><p class=""H1"">1 -14 1/2  oz. can diced tomatoes, with onion and garlic<br>1 -14  oz. can beef broth<br>1 1/2  c. water<br>1/2  tsp. dried Italian seasoning, crushed<br>1/2 of a 16  oz. package of frozen Italian style meatballs<br>1  c. frozen mixed vegetables<br>1/2  cup uncooked pasta, small sized<br>1  Tbsp. finely shredded or grated parmesan cheese<br></p></td></tr></tbody></table><table width=""100%"" border=""1px"" cellspacing=""0"" cellpadding=""10""><tbody><tr><td><span class=""H2"">preparation</span><br><p class=""H1"">      In large saucepan, combine undrained tomatoes, beef broth, water, and Italian seasoning and bring to boiling.  Stir in meatballs, frozen vegetables, and pasta.  Return to boiling, reduce heat.  Simmer covered for about 10 minutes or until vegetables are tender.  Ladle soup into serving bowls and top with parmesan cheese.  Makes 4 servings.</p></td></tr></tbody></table>"
"1522282021-1148","http://www.cookbooks.com/","Soup","http://www.cookbooks.com/recipes-search.aspx?id=1&tag=Soup","18","http://www.cookbooks.com/recipes-search.aspx?page=18","264. CHUCK WAGON CHILI SOUP","http://www.cookbooks.com/Recipe-Details.aspx?id=4813","<p class=""H2""><font size=""5"">CHUCK WAGON CHILI SOUP</font><br><span class=""H2""><font size=""4""><i></i></font></span><br></p><hr><p class=""H3""><strong></strong></p><table width=""100%"" border=""1px"" cellspacing=""0"" cellpadding=""10""><tbody><tr><td><span class=""H2"">ingredients</span><br><p class=""H1"">12  oz. ground beef (chuck)<br>1 1/2  c. chopped onions<br>2  Tbsp. minced garlic<br>3  Tbsp. chili powder<br>2  tsp. ground cumin<br>1  small butternut squash, peeled, seeded and cut in 3/4-inch chunks (approximately 4 c.)<br>4  c. beef broth (from cubes)<br>1  (28 oz.) crushed tomatoes<br>1  (16 oz.) barbecue baked beans<br>1  (15.5 oz.) red kidney beans, rinsed<br>1  (15.5 oz.) pinto beans, rinsed<br></p></td></tr></tbody></table><table width=""100%"" border=""1px"" cellspacing=""0"" cellpadding=""10""><tbody><tr><td><span class=""H2"">preparation</span><br><p class=""H1"">      Sauté beef in a 5-quart pot over medium heat 4 minutes or until brown.  Discard fat.  Sauté onions and garlic in pot 4 minutes or until soft.  Stir in chili powder and cumin, then squash, broth and 1 extra cup water.  Cover and gently boil 15 minutes until squash is almost tender.  Add tomatoes and beans; bring to a boil.  Reduce heat; cover and simmer 15 minutes to develop flavors.  Serve with shredded Cheddar cheese and sliced scallions.</p></td></tr></tbody></table>"
"1522282458-1343","http://www.cookbooks.com/","Soup","http://www.cookbooks.com/recipes-search.aspx?id=1&tag=Soup","5","http://www.cookbooks.com/recipes-search.aspx?page=5","69. CREAM OF ONION SOUP","http://www.cookbooks.com/Recipe-Details.aspx?id=1004","<p class=""H2""><font size=""5"">CREAM OF ONION SOUP</font><br><span class=""H2""><font size=""4""><i></i></font></span><br></p><hr><p class=""H3""><strong></strong></p><table width=""100%"" border=""1px"" cellspacing=""0"" cellpadding=""10""><tbody><tr><td><span class=""H2"">ingredients</span><br><p class=""H1"">6  medium onions, sliced<br>1/4  lb. butter<br>1/2  c. flour<br>1 to 1 1/2  tsp. salt<br>1/4  tsp. pepper<br>8  c. chicken stock or 8 c. water<br>1 2/3  c. cream<br>  French bread<br>  Swiss cheese, sliced<br></p></td></tr></tbody></table><table width=""100%"" border=""1px"" cellspacing=""0"" cellpadding=""10""><tbody><tr><td><span class=""H2"">preparation</span><br><p class=""H1"">      Sauté onions in butter until tender.  Blend in flour, salt and pepper.  Cook over low heat for 10 minutes.  Gradually stir in chicken base or water.  Bring to a boil, stirring constantly.  Stir in cream just before serving.  Put in ovenproof bowls.  Add 1 slice toasted French bread.  Top with Swiss cheese.  Bake until cheese is melted.</p></td></tr></tbody></table>"
"1522282361-1300","http://www.cookbooks.com/","Soup","http://www.cookbooks.com/recipes-search.aspx?id=1&tag=Soup","8","http://www.cookbooks.com/recipes-search.aspx?page=8","112. TAMALE LENTIL SOUP","http://www.cookbooks.com/Recipe-Details.aspx?id=1834","<p class=""H2""><font size=""5"">TAMALE LENTIL SOUP</font><br><span class=""H2""><font size=""4""><i></i></font></span><br></p><hr><p class=""H3""><strong></strong></p><table width=""100%"" border=""1px"" cellspacing=""0"" cellpadding=""10""><tbody><tr><td><span class=""H2"">ingredients</span><br><p class=""H1"">1/2  c. dry lentils<br>3 1/2  c. water<br>1  c. frozen whole kernel corn<br>1  c. frozen cut green beans<br>1  c. sliced zucchini or yellow summer squash<br>1  c. sliced celery<br>1  c. sliced carrot<br>1 (8 oz.)  can stewed tomatoes<br>1/2  c. chopped onion<br>1 (7 3/4 oz.)  can semi-condensed tomato soup<br>1/2  c. chopped green pepper<br>1  clove garlic, minced<br>3/4  tsp. chili powder<br>1/4  tsp. ground cumin<br>1/8  tsp. pepper<br>  Tamale Topper<br>1/2  c. shredded Cheddar cheese (2 oz.)<br></p></td></tr></tbody></table><table width=""100%"" border=""1px"" cellspacing=""0"" cellpadding=""10""><tbody><tr><td><span class=""H2"">preparation</span><br><p class=""H1"">      In a Dutch oven, combine uncooked lentils and 1 1/2 cups water. Bring to boiling; reduce the heat.  Cover and simmer for 20 minutes, then drain.  Stir in remaining water, corn, beans, zucchini, celery, carrot, tomatoes, tomato soup, onion, green pepper, garlic, chili powder, cumin and pepper.  Return to boiling, then reduce heat.  Cover and simmer about 20 minutes or until vegetables are almost tender.</p><p class=""H1"">      Tamale Topper:  In a saucepan, place 3/4 cup cornmeal. Gradually stir in 1 1/4 cups skim milk.  Cook and stir until thickened and bubbly.  Remove from heat, then stir in a beaten egg. Drop Tamale Topper in six mounds onto the hot stew.  Cover and simmer about 20 minutes or until topper is done.  Sprinkle with cheese.  Makes 6 servings with 6 grams fat per serving.</p></td></tr></tbody></table>"
"1522282037-1156","http://www.cookbooks.com/","Soup","http://www.cookbooks.com/recipes-search.aspx?id=1&tag=Soup","18","http://www.cookbooks.com/recipes-search.aspx?page=18","256. BAKED POTATO SOUP","http://www.cookbooks.com/Recipe-Details.aspx?id=4804","<p class=""H2""><font size=""5"">BAKED POTATO SOUP</font><br><span class=""H2""><font size=""4""><i></i></font></span><br></p><hr><p class=""H3""><strong></strong></p><table width=""100%"" border=""1px"" cellspacing=""0"" cellpadding=""10""><tbody><tr><td><span class=""H2"">ingredients</span><br><p class=""H1"">6  large potatoes<br>1/2  stick butter<br>1/2  c. flour<br>7  c. milk<br>1  c. sour cream<br>  salt and pepper<br>1  bunch green onions, chopped<br>1/2  lb. fried bacon, crumbled<br>1 1/2  c. grated Cheddar cheese<br></p></td></tr></tbody></table><table width=""100%"" border=""1px"" cellspacing=""0"" cellpadding=""10""><tbody><tr><td><span class=""H2"">preparation</span><br><p class=""H1"">      Bake potatoes until done.  Let cool.  Peel and dice potatoes. In large pot, melt butter on medium heat.  Add flour and stir until well blended.  Increase heat to medium, slowly adding milk until mixture is almost to a boil.  Add potatoes, onions and bacon.  Stir in cheese and sour cream.  Salt and pepper to taste. Heat until cheese is melted and serve.</p></td></tr></tbody></table>"
