web-scraper-order,web-scraper-start-url,cat,cat-href,page,page-href,title,title-href,info
"1522282560-1388","http://www.cookbooks.com/","Soup","http://www.cookbooks.com/recipes-search.aspx?id=1&tag=Soup","2","http://www.cookbooks.com/recipes-search.aspx?page=2","24. CRAB SOUP","http://www.cookbooks.com/Recipe-Details.aspx?id=861","<p class=""H2""><font size=""5"">CRAB SOUP</font><br><span class=""H2""><font size=""4""><i></i></font></span><br></p><hr><p class=""H3""><strong></strong></p><table width=""100%"" border=""1px"" cellspacing=""0"" cellpadding=""10""><tbody><tr><td><span class=""H2"">ingredients</span><br><p class=""H1"">2  Tbsp. butter<br>1/2  c. diced celery<br>1/2  c. diced carrots<br>1  leek, diced<br>1  green pepper, diced<br>1  onion, diced<br>1  qt. chicken broth<br>2  tomatoes, peeled and diced<br>1/2  tsp. saffron<br>1  can king crabmeat<br>1  Tbsp. cooked rice<br></p></td></tr></tbody></table><table width=""100%"" border=""1px"" cellspacing=""0"" cellpadding=""10""><tbody><tr><td><span class=""H2"">preparation</span><br><p class=""H1"">      Melt butter.  Add celery, carrots, leek, green pepper, onion and 1 cup of broth.  Simmer for 10 minutes.  Add tomatoes.  In separate pan, heat remaining broth with saffron to boiling point. Strain saffron and chicken broth mixture into first mixture.  Cook for 30 minutes.  Add crabmeat and rice.  Serve with crackers.</p></td></tr></tbody></table>"
"1522282390-1313","http://www.cookbooks.com/","Soup","http://www.cookbooks.com/recipes-search.aspx?id=1&tag=Soup","7","http://www.cookbooks.com/recipes-search.aspx?page=7","99. VEGETABLE SOUP","http://www.cookbooks.com/Recipe-Details.aspx?id=1080","<p class=""H2""><font size=""5"">VEGETABLE SOUP</font><br><span class=""H2""><font size=""4""><i></i></font></span><br></p><hr><p class=""H3""><strong></strong></p><table width=""100%"" border=""1px"" cellspacing=""0"" cellpadding=""10""><tbody><tr><td><span class=""H2"">ingredients</span><br><p class=""H1"">1  c. meat stock or bouillon cube<br>1/2  c. mixed vegetables with carrots and peas<br>1/2  small onion, chopped<br>1/4  c. cabbage, shredded<br>1  stalk celery, diced<br>1/4  c. tomato juice<br>  salt and pepper<br></p></td></tr></tbody></table><table width=""100%"" border=""1px"" cellspacing=""0"" cellpadding=""10""><tbody><tr><td><span class=""H2"">preparation</span><br><p class=""H1"">      Prepare vegetables and add to broth.  Boil together until vegetables are just tender for 20 minutes.  Makes 4 servings, each 1 cup.</p></td></tr></tbody></table>"
"1522282487-1355","http://www.cookbooks.com/","Soup","http://www.cookbooks.com/recipes-search.aspx?id=1&tag=Soup","4","http://www.cookbooks.com/recipes-search.aspx?page=4","57. CAULIFLOWER SOUP","http://www.cookbooks.com/Recipe-Details.aspx?id=992","<p class=""H2""><font size=""5"">CAULIFLOWER SOUP</font><br><span class=""H2""><font size=""4""><i></i></font></span><br></p><hr><p class=""H3""><strong></strong></p><table width=""100%"" border=""1px"" cellspacing=""0"" cellpadding=""10""><tbody><tr><td><span class=""H2"">ingredients</span><br><p class=""H1"">2  c. chopped celery<br>3/4  c. onion slices<br>6  Tbsp. margarine<br>1/3  c. flour<br>1/2  tsp. salt<br>1/4  tsp. pepper<br>4 1/2  c. chicken broth<br>3  c. milk<br>3 (10 oz.)  pkg. frozen cauliflower, cooked, drained and chopped<br>2  c. shredded Monterey Jack cheese<br></p></td></tr></tbody></table><table width=""100%"" border=""1px"" cellspacing=""0"" cellpadding=""10""><tbody><tr><td><span class=""H2"">preparation</span><br><p class=""H1"">      Sauté celery and onions in margarine.  Blend in flour and seasonings.  Gradually add broth and milk.  Cook, stirring constantly until thickened.  Add cauliflower and cheese.  Simmer until cheese is melted.</p></td></tr></tbody></table>"
"1522282206-1231","http://www.cookbooks.com/","Soup","http://www.cookbooks.com/recipes-search.aspx?id=1&tag=Soup","13","http://www.cookbooks.com/recipes-search.aspx?page=13","181. BLACK BEAN SOUP","http://www.cookbooks.com/Recipe-Details.aspx?id=4524","<p class=""H2""><font size=""5"">BLACK BEAN SOUP</font><br><span class=""H2""><font size=""4""><i></i></font></span><br></p><hr><p class=""H3""><strong></strong></p><table width=""100%"" border=""1px"" cellspacing=""0"" cellpadding=""10""><tbody><tr><td><span class=""H2"">ingredients</span><br><p class=""H1"">1  lb. black beans<br>6  c. water<br>4  c. chicken stock<br>1/4  c. olive oil<br>1  large onion, chopped<br>1 1/2  tsp. cumin<br>1 1/2  tsp. oregano<br>2  tsp. salt<br>1 1/2  c. cooked rice<br>4  Tbsp. garlic, minced<br></p></td></tr></tbody></table><table width=""100%"" border=""1px"" cellspacing=""0"" cellpadding=""10""><tbody><tr><td><span class=""H2"">preparation</span><br><p class=""H1"">	Cook beans in water. Cover and simmer (add salt) until most of the water is soaked up. Add stock and continue to cook 1 to 1 1/2 hours more.</p><p class=""H1"">	 In separate skillet, brown in olive oil garlic, onions, cumin and oregano. Add to beans after they have finished cooking. Cook 10 to 15 minutes longer.</p><p class=""H1"">	 Take 2 cups bean mixture and puree. Add back to soup along with rice. Top with sour cream and chives when served.</p></td></tr></tbody></table>"
"1522282259-1254","http://www.cookbooks.com/","Soup","http://www.cookbooks.com/recipes-search.aspx?id=1&tag=Soup","11","http://www.cookbooks.com/recipes-search.aspx?page=11","158. TACO SOUP","http://www.cookbooks.com/Recipe-Details.aspx?id=4385","<p class=""H2""><font size=""5"">TACO SOUP</font><br><span class=""H2""><font size=""4""><i></i></font></span><br></p><hr><p class=""H3""><strong></strong></p><table width=""100%"" border=""1px"" cellspacing=""0"" cellpadding=""10""><tbody><tr><td><span class=""H2"">ingredients</span><br><p class=""H1"">2  lb. ground beef<br>1  small onion<br>1 small  bottle mild Ortega taco sauce<br>3  cans (14.5 oz.) Sweet Sue beef broth<br>  salt to taste<br>1  tsp. chili powder<br>1/2  tsp. cumin<br>1 1/2  tsp. oregano<br>3  cans (16 oz.)  Bush's mixed beans<br>1 (14.5 oz.)  can Hunt's Choice diced tomatoes<br></p></td></tr></tbody></table><table width=""100%"" border=""1px"" cellspacing=""0"" cellpadding=""10""><tbody><tr><td><span class=""H2"">preparation</span><br><p class=""H1"">      Brown meat and drain.  Put all ingredients in a large pot. Cook on low, covered, for 1 1/2 hours.  Serve with Mexican finely shredded cheese and Santitos tortillas chips.</p></td></tr></tbody></table>"
"1522282454-1341","http://www.cookbooks.com/","Soup","http://www.cookbooks.com/recipes-search.aspx?id=1&tag=Soup","5","http://www.cookbooks.com/recipes-search.aspx?page=5","71. PUMPKIN VEGETABLE SOUP","http://www.cookbooks.com/Recipe-Details.aspx?id=1006","<p class=""H2""><font size=""5"">PUMPKIN VEGETABLE SOUP</font><br><span class=""H2""><font size=""4""><i></i></font></span><br></p><hr><p class=""H3""><strong></strong></p><table width=""100%"" border=""1px"" cellspacing=""0"" cellpadding=""10""><tbody><tr><td><span class=""H2"">ingredients</span><br><p class=""H1"">1  large onion, chopped<br>2  Tbsp. butter<br>3  c. chicken or beef broth<br>1/2  bag frozen mixed vegetables<br>1  large potato<br>1  stalk celery, sliced<br>1 (16 oz.)  can garbanzos or white kidney beans<br>1 (16 oz.)  can pumpkin puree<br>1/2  tsp. salt<br>1/4  tsp. ground nutmeg<br>1/8  tsp. white pepper<br>1/2  pt. heavy or whipping cream<br></p></td></tr></tbody></table><table width=""100%"" border=""1px"" cellspacing=""0"" cellpadding=""10""><tbody><tr><td><span class=""H2"">preparation</span><br><p class=""H1"">      In a Dutch oven, sauté onion 5 minutes in hot butter.  Add broth and heat to boiling; add vegetables, potato, celery and beans.  Then cover and cook until potatoes are tender.  Add pumpkin and seasoning; over high heat, heat to boiling.  Cover and reduce to low; cook 5 minutes.  Stir in cream and heat through.  Serve in hollowed out pumpkin.  Can add small amount of raw pumpkin, put in with vegetables, if desired.  Makes 8 servings.</p></td></tr></tbody></table>"
"1522282367-1303","http://www.cookbooks.com/","Soup","http://www.cookbooks.com/recipes-search.aspx?id=1&tag=Soup","8","http://www.cookbooks.com/recipes-search.aspx?page=8","109. ORIENTAL DUMPLING SOUP","http://www.cookbooks.com/Recipe-Details.aspx?id=1707","<p class=""H1"">Could NOT Open Recipe Page Due To:</p>Conversion from type 'DBNull' to type 'String' is not valid."
"1522282539-1379","http://www.cookbooks.com/","Soup","http://www.cookbooks.com/recipes-search.aspx?id=1&tag=Soup","3","http://www.cookbooks.com/recipes-search.aspx?page=3","33. BLACK BEAN SOUP","http://www.cookbooks.com/Recipe-Details.aspx?id=967","<p class=""H2""><font size=""5"">BLACK BEAN SOUP</font><br><span class=""H2""><font size=""4""><i></i></font></span><br></p><hr><p class=""H3""><strong></strong></p><table width=""100%"" border=""1px"" cellspacing=""0"" cellpadding=""10""><tbody><tr><td><span class=""H2"">ingredients</span><br><p class=""H1"">1 1/2  c. black beans<br>1 1/2  qt. water or vegetable stock<br>2  Tbsp. oil<br>1  onion<br>2  stalks celery<br>1  potato<br>1  carrot<br>1  tsp. oregano<br>1/4  tsp. savory<br>2  tsp. sea salt<br>1/8  tsp. cayenne pepper<br>1  bay leaf<br>  juice of 1 lemon<br></p></td></tr></tbody></table><table width=""100%"" border=""1px"" cellspacing=""0"" cellpadding=""10""><tbody><tr><td><span class=""H2"">preparation</span><br><p class=""H1"">      Wash the beans and put into a saucepan along with stock and 1 tablespoon oil.  Cover, boil and simmer for 2 1/2 hours.  Chop onion and sauté in remaining oil until soft.  Chop celery and leaves.  Grate potato and carrot.  Add these to onion and cook over medium heat for several minutes.  Add veggies to beans in the last hour they are cooking.  Add oregano, savory, salt, pepper and bay leaf.  Simmer until done.  Add lemon juice.  Delicious served over cooked brown rice.  Yields 8 to 10 servings.</p></td></tr></tbody></table>"
"1522282052-1162","http://www.cookbooks.com/","Soup","http://www.cookbooks.com/recipes-search.aspx?id=1&tag=Soup","17","http://www.cookbooks.com/recipes-search.aspx?page=17","250. MINESTRONE SOUP","http://www.cookbooks.com/Recipe-Details.aspx?id=4796","<p class=""H2""><font size=""5"">MINESTRONE SOUP</font><br><span class=""H2""><font size=""4""><i></i></font></span><br></p><hr><p class=""H3""><strong></strong></p><table width=""100%"" border=""1px"" cellspacing=""0"" cellpadding=""10""><tbody><tr><td><span class=""H2"">ingredients</span><br><p class=""H1"">6  c. water<br>2 large  cans whole tomatoes<br>1/2  c. celery<br>2  c. carrots<br>4  medium potatoes, cubed<br>1  large onion, chopped<br>2  tsp. salt<br>1  tsp. sugar<br>1  tsp. black pepper<br>1  lb. ground beef<br>1  lb. ground pork<br>2  eggs<br>1/2  c. bread crumbs<br>2  tsp. salt<br>  dash of pepper<br>2  cans cut green beans, strained<br>1  can whole kernel corn, strained<br></p></td></tr></tbody></table><table width=""100%"" border=""1px"" cellspacing=""0"" cellpadding=""10""><tbody><tr><td><span class=""H2"">preparation</span><br><p class=""H1"">      Put first 9 ingredients in large pot and put on stove to simmer.  While pot is simmering, prepare the following:  Mix together ground beef and pork, eggs, bread crumbs, salt and pepper. Roll into small 1-inch meatballs; add to boiling pot on stove. Simmer 30 minutes, then add green beans and corn.  Simmer another 10 minutes.</p></td></tr></tbody></table>"
"1522282161-1211","http://www.cookbooks.com/","Soup","http://www.cookbooks.com/recipes-search.aspx?id=1&tag=Soup","14","http://www.cookbooks.com/recipes-search.aspx?page=14","201. POTATO SOUP SUPREME","http://www.cookbooks.com/Recipe-Details.aspx?id=4561","<p class=""H1"">Could NOT Open Recipe Page Due To:</p>Conversion from type 'DBNull' to type 'String' is not valid."
"1522282407-1321","http://www.cookbooks.com/","Soup","http://www.cookbooks.com/recipes-search.aspx?id=1&tag=Soup","7","http://www.cookbooks.com/recipes-search.aspx?page=7","91. HOT AND SOUR SOUP","http://www.cookbooks.com/Recipe-Details.aspx?id=1051","<p class=""H2""><font size=""5"">HOT AND SOUR SOUP</font><br><span class=""H2""><font size=""4""><i></i></font></span><br></p><hr><p class=""H3""><strong></strong></p><table width=""100%"" border=""1px"" cellspacing=""0"" cellpadding=""10""><tbody><tr><td><span class=""H2"">ingredients</span><br><p class=""H1"">3  or 4 dried black mushrooms<br>1/4  lb. lean pork<br>2  bean curd cakes (tofu)<br>1  scallion<br>1  egg<br>2  Tbsp. cornstarch<br>1/4  c. water<br>5  c. chicken broth<br>1  c. mushroom-soaking liquid<br>1  Tbsp. sherry<br>2  Tbsp. white vinegar<br>3/4 to 1  tsp. salt<br>1  tsp. soy sauce<br>1/4  tsp. pepper<br>  Tabasco sauce<br></p></td></tr></tbody></table><table width=""100%"" border=""1px"" cellspacing=""0"" cellpadding=""10""><tbody><tr><td><span class=""H2"">preparation</span><br><p class=""H1"">      Soak dried mushrooms in water.  Reserve soaking liquid.  Sliver mushrooms, pork and bean curd.  Mince scallion.  Beat egg lightly. Blend cornstarch and cold water to make a paste.  Bring stock and mushroom-soaking liquid to a boil.  Add pork and mushrooms and simmer covered 10 minutes.  Add bean curd and simmer, covered, 3 minutes more.</p><p class=""H1"">      Stir in sherry, vinegar, salt, soy sauce and pepper.  Thicken with cornstarch paste.  Slowly add beaten egg, stirring gently once or twice.  Remove from heat.  Sprinkle with Tabasco sauce to taste and minced scallion.  Serve immediately.</p></td></tr></tbody></table>"
"1522282371-1305","http://www.cookbooks.com/","Soup","http://www.cookbooks.com/recipes-search.aspx?id=1&tag=Soup","8","http://www.cookbooks.com/recipes-search.aspx?page=8","107. BUTSON SOUP","http://www.cookbooks.com/Recipe-Details.aspx?id=1660","<p class=""H2""><font size=""5"">BUTSON SOUP</font><br><span class=""H2""><font size=""4""><i></i></font></span><br></p><hr><p class=""H3""><strong></strong></p><table width=""100%"" border=""1px"" cellspacing=""0"" cellpadding=""10""><tbody><tr><td><span class=""H2"">ingredients</span><br><p class=""H1"">1  beef rump roast<br>1  large onion, quartered<br>1 1/2  c. flour<br>2  eggs<br>  salt to taste<br></p></td></tr></tbody></table><table width=""100%"" border=""1px"" cellspacing=""0"" cellpadding=""10""><tbody><tr><td><span class=""H2"">preparation</span><br><p class=""H1"">      Place beef rump and onion in kettle and cover with water. Cook.  Put flour, eggs and salt in a separate bowl and stir until crumbly, then drop into water in which meat is cooking.  Continue to cook until meat is of desired tenderness.  You may add carrots to meat, if desired.  May be served as a first course after removing the meat.  Serve meat with German potato salad, buttered noodles or whatever.</p></td></tr></tbody></table>"
"1522282284-1265","http://www.cookbooks.com/","Soup","http://www.cookbooks.com/recipes-search.aspx?id=1&tag=Soup","10","http://www.cookbooks.com/recipes-search.aspx?page=10","147. EASY CHICKEN ENCHILADA SOUP","http://www.cookbooks.com/Recipe-Details.aspx?id=4281","<p class=""H2""><font size=""5"">EASY CHICKEN ENCHILADA SOUP</font><br><span class=""H2""><font size=""4""><i></i></font></span><br></p><hr><p class=""H3""><strong></strong></p><table width=""100%"" border=""1px"" cellspacing=""0"" cellpadding=""10""><tbody><tr><td><span class=""H2"">ingredients</span><br><p class=""H1"">1 (26 oz.)  can chicken and rice soup<br>1 (10 oz.)  can Ro-Tel tomatoes and chile peppers<br>1 (15 oz.)  can beans (black, pinto or kidney)<br>1 (15 oz.)  can yellow corn<br>1 large (12.5 oz.)  can chicken breast meat (Sweet Sue's works best)<br></p></td></tr></tbody></table><table width=""100%"" border=""1px"" cellspacing=""0"" cellpadding=""10""><tbody><tr><td><span class=""H2"">preparation</span><br><p class=""H1"">      Mix and warm to boil.</p></td></tr></tbody></table>"
"1522282464-1346","http://www.cookbooks.com/","Soup","http://www.cookbooks.com/recipes-search.aspx?id=1&tag=Soup","5","http://www.cookbooks.com/recipes-search.aspx?page=5","66. CREAM OF ANYTHING SOUP","http://www.cookbooks.com/Recipe-Details.aspx?id=1001","<p class=""H2""><font size=""5"">CREAM OF ANYTHING SOUP</font><br><span class=""H2""><font size=""4""><i></i></font></span><br></p><hr><p class=""H3""><strong></strong></p><table width=""100%"" border=""1px"" cellspacing=""0"" cellpadding=""10""><tbody><tr><td><span class=""H2"">ingredients</span><br><p class=""H1"">1/2  c. butter or margarine<br>1/2  c. flour<br>2 (14 1/2 oz.)  cans evaporated milk<br>  cheese (optional)<br>1 to 2  c. chopped meat or vegetables<br>2 to 3  c. broth<br></p></td></tr></tbody></table><table width=""100%"" border=""1px"" cellspacing=""0"" cellpadding=""10""><tbody><tr><td><span class=""H2"">preparation</span><br><p class=""H1"">      Make a roux of butter and flour; add milk and make a thick white sauce.  If cheese is used, add here and whisk to melt.  Mix in leftover cooked vegetables or meat; stir until smooth.  Add broth to desired consistency.  Season to taste.</p></td></tr></tbody></table>"
"1522282503-1363","http://www.cookbooks.com/","Soup","http://www.cookbooks.com/recipes-search.aspx?id=1&tag=Soup","4","http://www.cookbooks.com/recipes-search.aspx?page=4","49. MEXICAN CHEESE SOUP","http://www.cookbooks.com/Recipe-Details.aspx?id=984","<p class=""H2""><font size=""5"">MEXICAN CHEESE SOUP</font><br><span class=""H2""><font size=""4""><i></i></font></span><br></p><table width=""100%"" border=""0"" cellspacing=""2"" cellpending=""5""><tbody><tr><td valign=""top""><p class=""H2""><img src=""images-new/recipe-categories/soup-cheese.jpg"" alt=""MEXICAN CHEESE SOUP"" border=""0"" width=""200""></p></td><td valign=""middle""><p class=""H1""></p></td></tr></tbody></table><hr><p class=""H3""><strong></strong></p><table width=""100%"" border=""1px"" cellspacing=""0"" cellpadding=""10""><tbody><tr><td><span class=""H2"">ingredients</span><br><p class=""H1"">1/2  c. finely chopped onion<br>1/2  c. shredded carrots<br>1/2  c. thinly sliced celery<br>1/3  c. butter or margarine<br>1/3  c. flour<br>1  tsp. paprika<br>1  tsp. dry mustard<br>1  tsp. Worcestershire sauce<br>1 (14 1/2 oz.)  can chicken broth<br>1  c. milk<br>1/2  tsp. liquid smoke<br>1  c. shredded Cheddar cheese<br>  canned chopped green chilies<br>  tortilla chips (nacho cheese)<br></p></td></tr></tbody></table><table width=""100%"" border=""1px"" cellspacing=""0"" cellpadding=""10""><tbody><tr><td><span class=""H2"">preparation</span><br><p class=""H1"">      In a medium saucepan cook onion, carrots and celery in butter or margarine until tender.  Stir in flour, paprika, dry mustard and Worcestershire sauce until blended.  Add chicken broth and milk. Stir over medium heat until mixture thickens and bubbles.  Stir in liquid smoke.  Reduce heat to very low, then stir in cheese. Simmer 10 minutes.  Ladle soup in bowls; top soup with chopped chilies and 4 or 5 tortilla chips.  Makes 4 servings.</p></td></tr></tbody></table>"
"1522282004-1141","http://www.cookbooks.com/","Soup","http://www.cookbooks.com/recipes-search.aspx?id=1&tag=Soup","19","http://www.cookbooks.com/recipes-search.aspx?page=19","271. FISH SOUP","http://www.cookbooks.com/Recipe-Details.aspx?id=4868","<p class=""H2""><font size=""5"">FISH SOUP</font><br><span class=""H2""><font size=""4""><i></i></font></span><br></p><hr><p class=""H3""><strong></strong></p><table width=""100%"" border=""1px"" cellspacing=""0"" cellpadding=""10""><tbody><tr><td><span class=""H2"">ingredients</span><br><p class=""H1"">2  lb. fish meat, chopped<br>1  medium onion, sliced<br>2  large potatoes, sliced<br>2  large tomatoes, sliced<br>1/4  c. olive oil<br>2  garlic cloves, minced<br>2  bay leaves<br>1/4  c. finely chopped parsley<br></p></td></tr></tbody></table><table width=""100%"" border=""1px"" cellspacing=""0"" cellpadding=""10""><tbody><tr><td><span class=""H2"">preparation</span><br><p class=""H1"">      Over medium heat, cook potatoes, onion, garlic and bay leaves in a saucepan for 5 minutes until onions are translucent.  Add remaining ingredients, except fish.  Boil until vegetables are tender.  Add fish and heat until cooked through.  Add salt and pepper to taste.</p></td></tr></tbody></table>"
"1522281958-1120","http://www.cookbooks.com/","Soup","http://www.cookbooks.com/recipes-search.aspx?id=1&tag=Soup","20","http://www.cookbooks.com/recipes-search.aspx?page=20","292. CREAM OF BROCCOLI SOUP","http://www.cookbooks.com/Recipe-Details.aspx?id=4978","<p class=""H2""><font size=""5"">CREAM OF BROCCOLI SOUP</font><br><span class=""H2""><font size=""4""><i></i></font></span><br></p><hr><p class=""H3""><strong></strong></p><table width=""100%"" border=""1px"" cellspacing=""0"" cellpadding=""10""><tbody><tr><td><span class=""H2"">ingredients</span><br><p class=""H1"">2  boxes broccoli<br>1  chopped onion<br>1  stick oleo<br>3  cans cream of mushroom soup<br>3 soup  cans milk<br>1 (16 oz.)  jar of Cheez Whiz<br></p></td></tr></tbody></table><table width=""100%"" border=""1px"" cellspacing=""0"" cellpadding=""10""><tbody><tr><td><span class=""H2"">preparation</span><br><p class=""H1"">      Cook broccoli according to directions on package. Sauté onion in oleo.  Add broccoli, soup and milk, stirring well.  Add Cheez Whiz, let come to boil, then simmer a few minutes longer.</p></td></tr></tbody></table>"
"1522282018-1147","http://www.cookbooks.com/","Soup","http://www.cookbooks.com/recipes-search.aspx?id=1&tag=Soup","18","http://www.cookbooks.com/recipes-search.aspx?page=18","265. POTATO SOUP","http://www.cookbooks.com/Recipe-Details.aspx?id=4815","<p class=""H2""><font size=""5"">POTATO SOUP</font><br><span class=""H2""><font size=""4""><i></i></font></span><br></p><hr><p class=""H3""><strong></strong></p><table width=""100%"" border=""1px"" cellspacing=""0"" cellpadding=""10""><tbody><tr><td><span class=""H2"">ingredients</span><br><p class=""H1"">1  stick butter<br>1/2  c. onions<br>1 1/2  c. celery<br>6  slices bacon<br>3/4  c. flour<br>1  qt. milk<br>2  qt. water (chicken stock)<br>  diced raw potatoes<br>  white pepper<br>2  c. sharp Cheddar cheese<br>  fresh parsley<br></p></td></tr></tbody></table><table width=""100%"" border=""1px"" cellspacing=""0"" cellpadding=""10""><tbody><tr><td><span class=""H2"">preparation</span><br><p class=""H1"">      Sauté butter, onions and celery.  Add bacon; fry and drain. Add flour and stir in milk, water, potatoes and white pepper.  Add cheese right before serving.</p></td></tr></tbody></table>"
"1522281947-1115","http://www.cookbooks.com/","Soup","http://www.cookbooks.com/recipes-search.aspx?id=1&tag=Soup","20","http://www.cookbooks.com/recipes-search.aspx?page=20","297. MINESTRONE SOUP","http://www.cookbooks.com/Recipe-Details.aspx?id=5006","<p class=""H2""><font size=""5"">MINESTRONE SOUP</font><br><span class=""H2""><font size=""4""><i></i></font></span><br></p><hr><p class=""H3""><strong></strong></p><table width=""100%"" border=""1px"" cellspacing=""0"" cellpadding=""10""><tbody><tr><td><span class=""H2"">ingredients</span><br><p class=""H1"">1/2  cup chopped onion<br>3  cloves garlic, minced<br>2  sticks celery, chopped<br>1/2  cup chopped green pepper<br>4  Tbsp. olive oil or butter<br>1  quart canned tomatoes<br>2  carrots, diced<br>1  cup chick peas<br>  Small bunch parsley<br>1  c. kidney beans<br>2/3  cup water<br>2  vegetable bouillon cubes<br>1/2  c. wine (optional)<br>  Herb salt to taste<br>2  medium zucchini, chopped<br>1 1/2  c. cooked pasta<br>1  c. grated cheese<br></p></td></tr></tbody></table><table width=""100%"" border=""1px"" cellspacing=""0"" cellpadding=""10""><tbody><tr><td><span class=""H2"">preparation</span><br><p class=""H1"">      Sauté onion, garlic, celery, green pepper, in olive oil or butter.  Add all other ingredients except pasta and cheese.  Cook until all vegetables are tender.  Add cooked pasta.  Top each bowl with grated cheese.  Serves 12.</p></td></tr></tbody></table>"
"1522282401-1318","http://www.cookbooks.com/","Soup","http://www.cookbooks.com/recipes-search.aspx?id=1&tag=Soup","7","http://www.cookbooks.com/recipes-search.aspx?page=7","94. DUCK SOUP","http://www.cookbooks.com/Recipe-Details.aspx?id=1054","<p class=""H2""><font size=""5"">DUCK SOUP</font><br><span class=""H2""><font size=""4""><i></i></font></span><br></p><hr><p class=""H3""><strong></strong></p><table width=""100%"" border=""1px"" cellspacing=""0"" cellpadding=""10""><tbody><tr><td><span class=""H2"">ingredients</span><br><p class=""H1"">1  (5 lb.) duck<br>2  Tbsp. vinegar<br>1  medium onion<br>5  stalks celery, sliced<br>5  carrots, sliced<br>1  pkg. pitted prunes<br>1/2  box raisins<br>5  apples, sliced<br>  salt to taste<br>1/2 to 3/4  c. flour<br>  half and half cream<br>  egg noodles, cooked<br></p></td></tr></tbody></table><table width=""100%"" border=""1px"" cellspacing=""0"" cellpadding=""10""><tbody><tr><td><span class=""H2"">preparation</span><br><p class=""H1"">      Put duck in kettle with enough water to cover.  Heat to boiling.  Remove scum from surface of broth.  Put in the next 8 ingredients; cook until duck, vegetables and fruit are done. Remove duck from kettle.  Take meat off bones and put meat back in soup.  Combine 1/2 to 3/4 cup flour and enough cream to make a thin paste.  Add this mixture to soup and let simmer.  The soup will get thicker.  A little sugar or vinegar can be added for taste.  Serve with egg noodles.</p></td></tr></tbody></table>"
