web-scraper-order,web-scraper-start-url,cat,cat-href,page,page-href,title,title-href,info
"1522282183-1220","http://www.cookbooks.com/","Soup","http://www.cookbooks.com/recipes-search.aspx?id=1&tag=Soup","13","http://www.cookbooks.com/recipes-search.aspx?page=13","192. ENCHILADA SOUP","http://www.cookbooks.com/Recipe-Details.aspx?id=4548","<p class=""H2""><font size=""5"">ENCHILADA SOUP</font><br><span class=""H2""><font size=""4""><i></i></font></span><br></p><hr><p class=""H3""><strong></strong></p><table width=""100%"" border=""1px"" cellspacing=""0"" cellpadding=""10""><tbody><tr><td><span class=""H2"">ingredients</span><br><p class=""H1"">1  small onion, chopped<br>1  Tbsp. steak sauce<br>1  garlic clove, crushed<br>1  tsp. ground cumin<br>2  Tbsp. vegetable oil<br>1  tsp. chili powder<br>1  can cream of chicken soup<br>2  tsp. Worcestershire<br>1  can chicken broth<br>2  Tbsp. enchilada seasoning<br>1  can beef broth<br>  paprika<br>1  can (4 oz.) chopped green chilies undrained<br>1  bag Tostitos chips<br>1  jar (15 oz.) of queso cheese dip<br>1 1/2   c. water<br>1 to 2  lb. ground meat<br>1/8  tsp. black pepper<br></p></td></tr></tbody></table><table width=""100%"" border=""1px"" cellspacing=""0"" cellpadding=""10""><tbody><tr><td><span class=""H2"">preparation</span><br><p class=""H1"">      Sauté onion and garlic in oil over medium high heat. Add ground meat to onions and garlic; brown. Add undiluted soups, chilies, water, steak sauce, Worcestershire sauce, cumin, chili powder, pepper, and enchilada seasoning; bring to a boil. Cover and reduce heat; simmer 1 hour. Add chips and queso cheese dip. Simmer uncovered 10 minutes. Sprinkle with paprika and serve.</p><p class=""H1"">      Note: The more chips added, the thicker the soup will be. Also, you can substitute 3 boneless chicken breasts for the ground meat, using chicken broth instead of plain water.</p></td></tr></tbody></table>"
"1522282060-1166","http://www.cookbooks.com/","Soup","http://www.cookbooks.com/recipes-search.aspx?id=1&tag=Soup","17","http://www.cookbooks.com/recipes-search.aspx?page=17","246. TOMATO SOUP SALAD","http://www.cookbooks.com/Recipe-Details.aspx?id=4784","<p class=""H2""><font size=""5"">TOMATO SOUP SALAD</font><br><span class=""H2""><font size=""4""><i></i></font></span><br></p><hr><p class=""H3""><strong></strong></p><table width=""100%"" border=""1px"" cellspacing=""0"" cellpadding=""10""><tbody><tr><td><span class=""H2"">ingredients</span><br><p class=""H1"">1  c. tomato soup (undiluted)<br>1  c. mayonnaise<br>1  c. celery, diced<br>1/4 to 1/2  c. onion, chopped<br>1 (3 oz.)  pkg. lemon jello<br>1  c. cottage cheese<br>1  c. bell pepper, chopped<br></p></td></tr></tbody></table><table width=""100%"" border=""1px"" cellspacing=""0"" cellpadding=""10""><tbody><tr><td><span class=""H2"">preparation</span><br><p class=""H1"">      Heat undiluted soup until hot, but not boiling. Stir in lemon jello until dissolved. Add remaining ingredients and mix well. Pour into mold and refrigerate.</p></td></tr></tbody></table>"
"1522282554-1385","http://www.cookbooks.com/","Soup","http://www.cookbooks.com/recipes-search.aspx?id=1&tag=Soup","2","http://www.cookbooks.com/recipes-search.aspx?page=2","27. ASPARAGUS SOUP","http://www.cookbooks.com/Recipe-Details.aspx?id=960","<p class=""H2""><font size=""5"">ASPARAGUS SOUP</font><br><span class=""H2""><font size=""4""><i></i></font></span><br></p><hr><p class=""H3""><strong></strong></p><table width=""100%"" border=""1px"" cellspacing=""0"" cellpadding=""10""><tbody><tr><td><span class=""H2"">ingredients</span><br><p class=""H1"">1  can (approximately 1 lb.) asparagus<br>  bouillon cubes or powder to make 4 c.<br>1  qt. boiling water<br>  dash of onion powder<br>  pinch of powdered mace<br></p></td></tr></tbody></table><table width=""100%"" border=""1px"" cellspacing=""0"" cellpadding=""10""><tbody><tr><td><span class=""H2"">preparation</span><br><p class=""H1"">      Put asparagus pieces and liquid in blender and blend smooth. In saucepan, combine bouillon and boiling water; add asparagus. Add seasonings.  Bring to a boil.  Serve hot with a dot of unsalted butter on each cup or soup plate.</p></td></tr></tbody></table>"
"1522282392-1314","http://www.cookbooks.com/","Soup","http://www.cookbooks.com/recipes-search.aspx?id=1&tag=Soup","7","http://www.cookbooks.com/recipes-search.aspx?page=7","98. ASPARAGUS AND CHICKEN SOUP","http://www.cookbooks.com/Recipe-Details.aspx?id=1059","<p class=""H2""><font size=""5"">ASPARAGUS AND CHICKEN SOUP</font><br><span class=""H2""><font size=""4""><i></i></font></span><br></p><hr><p class=""H3""><strong></strong></p><table width=""100%"" border=""1px"" cellspacing=""0"" cellpadding=""10""><tbody><tr><td><span class=""H2"">ingredients</span><br><p class=""H1"">8  c. chicken stock<br>1  large chicken breast<br>1  bunch fresh asparagus<br>4  tsp. cornstarch<br>3  Tbsp. cold water<br>2 1/2  Tbsp. dry sherry<br>2  eggs, beaten<br></p></td></tr></tbody></table><table width=""100%"" border=""1px"" cellspacing=""0"" cellpadding=""10""><tbody><tr><td><span class=""H2"">preparation</span><br><p class=""H1"">      Heat stock.  Cut chicken into small pieces.  After asparagus is cooked, cut into small pieces.  Save 1 cup of water to add to chicken stock.  Add chicken and boil.  Reduce heat and simmer for 10 minutes.  Mix cornstarch with cold water and add to soup, stirring constantly.  Add sherry.  Slowly add beaten eggs and asparagus.  Heat through.</p></td></tr></tbody></table>"
"1522281991-1135","http://www.cookbooks.com/","Soup","http://www.cookbooks.com/recipes-search.aspx?id=1&tag=Soup","19","http://www.cookbooks.com/recipes-search.aspx?page=19","277. MUSHROOM SOUP","http://www.cookbooks.com/Recipe-Details.aspx?id=4886","<p class=""H2""><font size=""5"">MUSHROOM SOUP</font><br><span class=""H2""><font size=""4""><i></i></font></span><br></p><hr><p class=""H3""><strong></strong></p><table width=""100%"" border=""1px"" cellspacing=""0"" cellpadding=""10""><tbody><tr><td><span class=""H2"">ingredients</span><br><p class=""H1"">6 cups homemade chicken broth, or three  cans (14 1/2-oz. each) prepared chicken broth<br>1/3  c. wild rice<br>2  c. half-and-half cream<br>4  Tbsp. flour<br>1/4  tsp. thyme<br>4  Tbsp. butter<br>1  c. sliced green onion<br>1  lb. fresh mushrooms, sliced<br></p></td></tr></tbody></table><table width=""100%"" border=""1px"" cellspacing=""0"" cellpadding=""10""><tbody><tr><td><span class=""H2"">preparation</span><br><p class=""H1"">      In a large saucepan combine chicken broth and wild rice. Bring to boil; reduce heat to low, cover and simmer until rice is cooked.  Whisk flour and thyme into cream; add to broth and rice stirring constantly and heat until thickened.  Meanwhile, melt butter in skillet and sauté mushrooms and onions for about 5 minutes; add to soup mixture.  Cook a few minutes more until hot but not boiling.  Serve immediately.  Serves 8.</p></td></tr></tbody></table>"
"1522282151-1206","http://www.cookbooks.com/","Soup","http://www.cookbooks.com/recipes-search.aspx?id=1&tag=Soup","14","http://www.cookbooks.com/recipes-search.aspx?page=14","206. CHEESE SOUP","http://www.cookbooks.com/Recipe-Details.aspx?id=4604","<p class=""H2""><font size=""5"">CHEESE SOUP</font><br><span class=""H2""><font size=""4""><i></i></font></span><br></p><hr><p class=""H3""><strong></strong></p><table width=""100%"" border=""1px"" cellspacing=""0"" cellpadding=""10""><tbody><tr><td><span class=""H2"">ingredients</span><br><p class=""H1"">4  chicken bouillon cubes<br>1  qt. water<br>1  c. diced celery<br>1  c. diced onion<br>2 1/2  c. potatoes, diced<br>1  c. diced carrots<br>2  cans cream of chicken soup<br>1 - 1  lb. velveeta cheese, cubed<br></p></td></tr></tbody></table><table width=""100%"" border=""1px"" cellspacing=""0"" cellpadding=""10""><tbody><tr><td><span class=""H2"">preparation</span><br><p class=""H1"">      Cook chicken bouillon, water, celery, and onion for 20 minutes in large pot with lid on.  Add potatoes and carrots.  Cook another 20 minutes or until tender.  Add cream of chicken soup and cheese cubes.  Heat through until the cheese melts, stirring often.  If too thick, add a little more water.  Season to taste with salt and pepper.  Soup can be frozen.</p></td></tr></tbody></table>"
"1522282491-1357","http://www.cookbooks.com/","Soup","http://www.cookbooks.com/recipes-search.aspx?id=1&tag=Soup","4","http://www.cookbooks.com/recipes-search.aspx?page=4","55. CREAM OF TOMATO SOUP","http://www.cookbooks.com/Recipe-Details.aspx?id=990","<p class=""H2""><font size=""5"">CREAM OF TOMATO SOUP</font><br><span class=""H2""><font size=""4""><i></i></font></span><br></p><hr><p class=""H3""><strong></strong></p><table width=""100%"" border=""1px"" cellspacing=""0"" cellpadding=""10""><tbody><tr><td><span class=""H2"">ingredients</span><br><p class=""H1"">2  c. tomato juice<br>1/2  stick margarine<br>5  Tbsp. flour<br>1/2  tsp. salt<br>1/8  tsp. pepper<br>2  c. milk<br>1/8  tsp. baking soda<br></p></td></tr></tbody></table><table width=""100%"" border=""1px"" cellspacing=""0"" cellpadding=""10""><tbody><tr><td><span class=""H2"">preparation</span><br><p class=""H1"">      In small stew pan, place tomato juice and place on stove to warm.  In larger pan, melt margarine; remove from heat.  Mix in flour, salt and pepper; stir until smooth.  Add milk and place on stove; bring to a boil, stirring constantly.  Cook until thickened; remove from heat.  Stir baking soda into warm tomato juice and then stir into gravy mixture.  Serve with crackers or garlic toast.</p></td></tr></tbody></table>"
"1522282117-1191","http://www.cookbooks.com/","Soup","http://www.cookbooks.com/recipes-search.aspx?id=1&tag=Soup","15","http://www.cookbooks.com/recipes-search.aspx?page=15","221. ITALIAN WEDDING SOUP","http://www.cookbooks.com/Recipe-Details.aspx?id=4675","<p class=""H1"">Could NOT Open Recipe Page Due To:</p>Conversion from type 'DBNull' to type 'String' is not valid."
"1522282263-1256","http://www.cookbooks.com/","Soup","http://www.cookbooks.com/recipes-search.aspx?id=1&tag=Soup","11","http://www.cookbooks.com/recipes-search.aspx?page=11","156. POTATO SOUP","http://www.cookbooks.com/Recipe-Details.aspx?id=4383","<p class=""H2""><font size=""5"">POTATO SOUP</font><br><span class=""H2""><font size=""4""><i></i></font></span><br></p><hr><p class=""H3""><strong></strong></p><table width=""100%"" border=""1px"" cellspacing=""0"" cellpadding=""10""><tbody><tr><td><span class=""H2"">ingredients</span><br><p class=""H1"">6  slices bacon, fried and drained<br>3  Tbsp. bacon grease<br>3/4  c. onion<br>3  c. potatoes, cut small<br>1 1/2  c. water<br>2  cans cream of mushroom soup<br>  salt to taste<br>2 soup  cans of milk<br></p></td></tr></tbody></table><table width=""100%"" border=""1px"" cellspacing=""0"" cellpadding=""10""><tbody><tr><td><span class=""H2"">preparation</span><br><p class=""H1"">      Pour off all but 3 tablespoons of bacon grease.  Saut onions in grease and add potatoes, salt and water.  Cook until potatoes are done.  Add soup and milk.  Serve with crumbled bacon on top. Makes 8 servings.</p></td></tr></tbody></table>"
"1522282254-1252","http://www.cookbooks.com/","Soup","http://www.cookbooks.com/recipes-search.aspx?id=1&tag=Soup","11","http://www.cookbooks.com/recipes-search.aspx?page=11","160. TORTILLA SOUP","http://www.cookbooks.com/Recipe-Details.aspx?id=4387","<p class=""H2""><font size=""5"">TORTILLA SOUP</font><br><span class=""H2""><font size=""4""><i></i></font></span><br></p><hr><p class=""H3""><strong></strong></p><table width=""100%"" border=""1px"" cellspacing=""0"" cellpadding=""10""><tbody><tr><td><span class=""H2"">ingredients</span><br><p class=""H1"">4  chicken bouillon cubes<br>1  beef bouillon cube<br>5  c. boiling water<br>4  boneless chicken breasts, cut in 1/2-inch pieces<br>1  tsp. cumin<br>2  Tbsp. vegetable oil<br>1  green bell pepper, chopped<br>1  large onion, chopped<br>  garlic salt or powder to taste<br>1 (10 oz.)  can beef consomm<br>1 (10 oz.)  can Ro-Tel tomatoes, drained and chopped<br>1 (16 oz.)  can peeled tomatoes, drained and chopped<br>1 (15 oz.)  can tomato sauce<br>1  can chopped green chilies, drained (optional)<br>2  Tbsp. cornstarch<br>  salt and pepper to taste<br></p></td></tr></tbody></table><table width=""100%"" border=""1px"" cellspacing=""0"" cellpadding=""10""><tbody><tr><td><span class=""H2"">preparation</span><br><p class=""H1"">      Dissolve bouillon cubes in boiling water in large soup pot. Stir in chicken and cumin.  Simmer over low heat 2 hours.  Heat oil in saucepan.  Add green pepper, onion and garlic.  Sauté until tender.  Stir into soup pot.  Add consomm, tomatoes, tomato sauce and green chilies.  Mix well.  Blend cornstarch with 1 tablespoon soup liquid.  Stir into soup.  Simmer 1 to 2 hours or until heated through, stirring occasionally.  Add salt and pepper.  In individual serving bowl, top with tortilla chips, shredded Monterey Jack cheese, chopped onion or chopped avocado if you like.</p></td></tr></tbody></table>"
"1522282166-1213","http://www.cookbooks.com/","Soup","http://www.cookbooks.com/recipes-search.aspx?id=1&tag=Soup","14","http://www.cookbooks.com/recipes-search.aspx?page=14","199. DELI'S TACO SOUP","http://www.cookbooks.com/Recipe-Details.aspx?id=4558","<p class=""H2""><font size=""5"">DELI'S TACO SOUP</font><br><span class=""H2""><font size=""4""><i></i></font></span><br></p><hr><p class=""H3""><strong></strong></p><table width=""100%"" border=""1px"" cellspacing=""0"" cellpadding=""10""><tbody><tr><td><span class=""H2"">ingredients</span><br><p class=""H1"">1  lb. ground chuck<br>1  onion, chopped<br>1/2  c. celery, chopped<br>1/2  c. bell pepper, chopped<br>1  can whole kernel corn<br>1  can pinto beans<br>1  can tomatoes, diced<br>1  can evaporated milk<br>1 small  pkg. Velveeta<br>1  envelope taco seasoning<br>  TexJoy steak seasoning, to taste<br></p></td></tr></tbody></table><table width=""100%"" border=""1px"" cellspacing=""0"" cellpadding=""10""><tbody><tr><td><span class=""H2"">preparation</span><br><p class=""H1"">      Brown meat with onion, celery, and bell pepper. Add taco seasoning when meat is done. Add cans of vegetables, milk and cheese and simmer until done. Add small amount of water if it is too thick.</p></td></tr></tbody></table>"
"1522282397-1316","http://www.cookbooks.com/","Soup","http://www.cookbooks.com/recipes-search.aspx?id=1&tag=Soup","7","http://www.cookbooks.com/recipes-search.aspx?page=7","96. CABBAGE PATCH SOUP","http://www.cookbooks.com/Recipe-Details.aspx?id=1057","<p class=""H2""><font size=""5"">CABBAGE PATCH SOUP</font><br><span class=""H2""><font size=""4""><i></i></font></span><br></p><hr><p class=""H3""><strong></strong></p><table width=""100%"" border=""1px"" cellspacing=""0"" cellpadding=""10""><tbody><tr><td><span class=""H2"">ingredients</span><br><p class=""H1"">1  c. chopped onion<br>2  cloves garlic<br>1  c. chopped green pepper<br>1  tsp. oregano<br>1 1/2 to 2  Tbsp. chili powder<br>2  lb. lean ground beef<br>1 (6 oz.)  can tomato paste<br>3  beef bouillon cubes<br>1 (15 oz.)  can kidney beans, rinsed and drained<br>1 (16 oz.)  can stewed tomatoes<br>1/2  head red cabbage, chopped<br>1/2  head white cabbage, chopped<br>  Cheddar cheese (optional)<br></p></td></tr></tbody></table><table width=""100%"" border=""1px"" cellspacing=""0"" cellpadding=""10""><tbody><tr><td><span class=""H2"">preparation</span><br><p class=""H1"">      Sauté onion, garlic, green pepper, oregano, chili powder and beef together.  Drain fat, if any.  Then add 7 to 8 cups water, depending on desired thickness.  Add remaining ingredients, except cheese.  Bring mixture to a boil and simmer for 1 hour.  Can top with Cheddar cheese, grated.  Serve with cornbread.</p></td></tr></tbody></table>"
"1522282426-1329","http://www.cookbooks.com/","Soup","http://www.cookbooks.com/recipes-search.aspx?id=1&tag=Soup","6","http://www.cookbooks.com/recipes-search.aspx?page=6","83. CHESAPEAKE BAY CRAB SOUP","http://www.cookbooks.com/Recipe-Details.aspx?id=1043","<p class=""H2""><font size=""5"">CHESAPEAKE BAY CRAB SOUP</font><br><span class=""H2""><font size=""4""><i></i></font></span><br></p><hr><p class=""H3""><strong></strong></p><table width=""100%"" border=""1px"" cellspacing=""0"" cellpadding=""10""><tbody><tr><td><span class=""H2"">ingredients</span><br><p class=""H1"">1/4  c. butter<br>1/2  c. chopped onion<br>1/2  c. chopped green bell pepper<br>4  c. fish stock or bottled clam juice<br>1/4  c. long-grain rice<br>1  lb. lump crabmeat, free of shell and cartilage<br>1  large tomato, peeled and diced<br>1  tsp. chili powder<br>1  tsp. paprika<br>1/2  tsp. Worcestershire sauce<br>1/2  tsp. sugar<br>  salt and pepper to taste<br></p></td></tr></tbody></table><table width=""100%"" border=""1px"" cellspacing=""0"" cellpadding=""10""><tbody><tr><td><span class=""H2"">preparation</span><br><p class=""H1"">      Melt butter in a 2-quart pot and sauté onion and green pepper until onion is soft.  Add fish stock and rice.  Simmer, partially covered, 15 minutes.  Add crabmeat, tomato, chili powder, paprika and Worcestershire and simmer 20 minutes.  Remove from heat and stir in sugar, salt and pepper.  Makes 4 servings.</p></td></tr></tbody></table>"
"1522282313-1278","http://www.cookbooks.com/","Soup","http://www.cookbooks.com/recipes-search.aspx?id=1&tag=Soup","9","http://www.cookbooks.com/recipes-search.aspx?page=9","134. SPINACH SOUP","http://www.cookbooks.com/Recipe-Details.aspx?id=2699","<p class=""H2""><font size=""5"">SPINACH SOUP</font><br><span class=""H2""><font size=""4""><i></i></font></span><br></p><hr><p class=""H3""><strong></strong></p><table width=""100%"" border=""1px"" cellspacing=""0"" cellpadding=""10""><tbody><tr><td><span class=""H2"">ingredients</span><br><p class=""H1"">4  Tbsp. margarine<br>1  c. diced raw potatoes<br>1/2  c. sliced onions<br>1  c. sliced fresh mushrooms<br>1  lb. fresh spinach, chopped finely<br>4  c. chicken broth (College Inn)<br>  salt and pepper to taste<br>1/4  tsp. ground cloves<br>1/2  c. oatmeal<br></p></td></tr></tbody></table><table width=""100%"" border=""1px"" cellspacing=""0"" cellpadding=""10""><tbody><tr><td><span class=""H2"">preparation</span><br><p class=""H1"">      In skillet, melt margarine on low heat and add potatoes, onions and mushrooms.  Cover pan and cook 8 to 10 minutes, until soft and translucent.  Wash spinach; pick off tough stems and chop finely. Pour stock into large pan and add potatoes, onions, mushrooms and spinach.  Season with salt, pepper and cloves.  Add oatmeal. Simmer 20 minutes.</p></td></tr></tbody></table>"
"1522282348-1294","http://www.cookbooks.com/","Soup","http://www.cookbooks.com/recipes-search.aspx?id=1&tag=Soup","8","http://www.cookbooks.com/recipes-search.aspx?page=8","118. BAKED POTATO SOUP","http://www.cookbooks.com/Recipe-Details.aspx?id=2204","<p class=""H2""><font size=""5"">BAKED POTATO SOUP</font><br><span class=""H2""><font size=""4""><i></i></font></span><br></p><hr><p class=""H3""><strong></strong></p><table width=""100%"" border=""1px"" cellspacing=""0"" cellpadding=""10""><tbody><tr><td><span class=""H2"">ingredients</span><br><p class=""H1"">4  large baking potatoes<br>2/3  c. butter or margarine<br>2/3  c. all-purpose flour<br>6  c. milk<br>3/4  tsp. salt<br>1/2  tsp. pepper<br>4  green onions, chopped and divided<br>12  slices bacon, cooked, crumbled and divided<br>1 1/4  c. (5 oz.) shredded Cheddar cheese, divided<br>1 (8 oz.)  carton sour cream<br></p></td></tr></tbody></table><table width=""100%"" border=""1px"" cellspacing=""0"" cellpadding=""10""><tbody><tr><td><span class=""H2"">preparation</span><br><p class=""H1"">      Wash potatoes and prick several times with a fork; bake at 400° for 1 hour or until done.  Let cool.  Cut potatoes in half lengthwise; then scoop out pulp and set aside.  Discard skins. Melt butter in a heavy saucepan over low heat; add flour, stirring until smooth.  Cook 1 minute, stirring constantly.  Gradually add milk; cook over medium heat, stirring constantly, until mixture is thickened and bubbly.  Add potato pulp, salt, pepper, 2 tablespoons green onions, 1/2 cup bacon and 1 cup cheese.  Cook until thoroughly heated; stir in sour cream.  Add extra milk, if necessary, for desired thickness.  Serve with remaining onion, bacon and cheese.</p></td></tr></tbody></table>"
"1522282134-1199","http://www.cookbooks.com/","Soup","http://www.cookbooks.com/recipes-search.aspx?id=1&tag=Soup","15","http://www.cookbooks.com/recipes-search.aspx?page=15","213. WEDDING SOUP","http://www.cookbooks.com/Recipe-Details.aspx?id=4650","<p class=""H2""><font size=""5"">WEDDING SOUP</font><br><span class=""H2""><font size=""4""><i></i></font></span><br></p><hr><p class=""H3""><strong></strong></p><table width=""100%"" border=""1px"" cellspacing=""0"" cellpadding=""10""><tbody><tr><td><span class=""H2"">ingredients</span><br><p class=""H1"">  meatballs, dime sized<br>1  egg<br>1  small onion, diced<br>1/2-1  c Italian bread crumbs<br>1/4  c parmesan cheese, grated<br>1  lb ground beef<br>3  tbsp parmesan cheese, grated<br>48 oz  can chicken broth<br>1/2  c acini de pepe pasta<br>1/2  c chopped frozen spinach<br></p></td></tr></tbody></table><table width=""100%"" border=""1px"" cellspacing=""0"" cellpadding=""10""><tbody><tr><td><span class=""H2"">preparation</span><br><p class=""H1"">      Cook meatballs as you normally would.  Keep rolled small.  Warm broth.  Add chopped spinach and boil.  Add precooked meatballs. Reduce to slow simmer.  Add acini de pepe until they are fully cooked.  Add 3 tbsp grated cheese and serve.</p></td></tr></tbody></table>"
"1522282300-1273","http://www.cookbooks.com/","Soup","http://www.cookbooks.com/recipes-search.aspx?id=1&tag=Soup","10","http://www.cookbooks.com/recipes-search.aspx?page=10","139. CHUNKY ITALIAN SOUP","http://www.cookbooks.com/Recipe-Details.aspx?id=4272","<p class=""H2""><font size=""5"">CHUNKY ITALIAN SOUP</font><br><span class=""H2""><font size=""4""><i></i></font></span><br></p><hr><p class=""H3""><strong></strong></p><table width=""100%"" border=""1px"" cellspacing=""0"" cellpadding=""10""><tbody><tr><td><span class=""H2"">ingredients</span><br><p class=""H1"">1  lb. ground beef<br>1  onion, chopped<br>2  cans Italian tomatoes<br>1  can tomato soup<br>4  c. water<br>1  clove garlic<br>2  tsp. salt<br>2  tsp. basil<br>2  tsp. oregano<br>1  Tbsp. chili powder<br>1  can kidney beans, drained<br>1  carrot, chopped<br>1  (8 oz.) rotini noodles, cooked<br></p></td></tr></tbody></table><table width=""100%"" border=""1px"" cellspacing=""0"" cellpadding=""10""><tbody><tr><td><span class=""H2"">preparation</span><br><p class=""H1"">      Cook beef and onion; drain. Stir in tomatoes and next 7 ingredients. Bring to boil. Reduce heat; simmer, stirring occasionally, about 30 minutes. Add next 3 ingredients and simmer 15 minutes. Stir in pasta. Pour into soup bowls and sprinkle with Parmesan cheese for each serving.</p></td></tr></tbody></table>"
"1522282292-1269","http://www.cookbooks.com/","Soup","http://www.cookbooks.com/recipes-search.aspx?id=1&tag=Soup","10","http://www.cookbooks.com/recipes-search.aspx?page=10","143. TACO SOUP","http://www.cookbooks.com/Recipe-Details.aspx?id=4277","<p class=""H2""><font size=""5"">TACO SOUP</font><br><span class=""H2""><font size=""4""><i></i></font></span><br></p><hr><p class=""H3""><strong></strong></p><table width=""100%"" border=""1px"" cellspacing=""0"" cellpadding=""10""><tbody><tr><td><span class=""H2"">ingredients</span><br><p class=""H1"">2  lb. ground beef<br>1  pkg. taco seasoning mix<br>1  pkg. Ranch dressing mix (dry)<br>1  jar picante sauce<br>1  can chilli beans<br>1 or 2  cans white Shoepeg corn (do not drain)<br>1  can Ro-Tel (do not drain)<br>1  qt. tomato juice or 2 cans diced tomatoes<br></p></td></tr></tbody></table><table width=""100%"" border=""1px"" cellspacing=""0"" cellpadding=""10""><tbody><tr><td><span class=""H2"">preparation</span><br><p class=""H1"">      Serve with tortilla chips and grated cheese. Makes a large pot of soup.</p></td></tr></tbody></table>"
"1522282541-1380","http://www.cookbooks.com/","Soup","http://www.cookbooks.com/recipes-search.aspx?id=1&tag=Soup","3","http://www.cookbooks.com/recipes-search.aspx?page=3","32. FRESH GREEN BEAN SOUP","http://www.cookbooks.com/Recipe-Details.aspx?id=966","<p class=""H2""><font size=""5"">FRESH GREEN BEAN SOUP</font><br><span class=""H2""><font size=""4""><i></i></font></span><br></p><hr><p class=""H3""><strong></strong></p><table width=""100%"" border=""1px"" cellspacing=""0"" cellpadding=""10""><tbody><tr><td><span class=""H2"">ingredients</span><br><p class=""H1"">1  lb. fresh string beans<br>2  medium-sized potatoes, diced<br>1  tsp. salt<br>2  Tbsp. flour<br>2  Tbsp. fat<br>1/4  tsp. black pepper<br>1/4  tsp. paprika<br>1/4  c. cold water<br>1  pt. sour cream<br></p></td></tr></tbody></table><table width=""100%"" border=""1px"" cellspacing=""0"" cellpadding=""10""><tbody><tr><td><span class=""H2"">preparation</span><br><p class=""H1"">      String and cut up beans.  Cook cut beans and diced potatoes in 5 cups of salted water for 15 minutes.  In a frying pan brown flour in the fat; add black pepper and paprika.  Add 1/4 cup cold water and stir until smooth.  Add sour cream.  Add this mixture to the cooked beans and potatoes.  Bring to a boil and simmer for a few minutes.</p></td></tr></tbody></table>"
