web-scraper-order,web-scraper-start-url,veg,veg-href,page,page-href,title,title-href,info
"1520704765-515","http://www.cookbooks.com/","Vegetable","http://www.cookbooks.com/recipes-search.aspx?cid=1004&tag=Vegetable","7","http://www.cookbooks.com/recipes-search.aspx?page=7","94. STEAMED SWEET POTATOES","http://www.cookbooks.com/Recipe-Details.aspx?id=1476","<p class=""H2""><font size=""5"">STEAMED SWEET POTATOES</font><br><span class=""H2""><font size=""4""><i></i></font></span><br></p><hr><p class=""H3""><strong></strong></p><table width=""100%"" border=""1px"" cellspacing=""0"" cellpadding=""10""><tbody><tr><td><span class=""H2"">ingredients</span><br><p class=""H1"">6  medium to large sweet potatoes or yams<br>1/4  c. melted butter<br>1/2  tsp. ground cloves<br></p></td></tr></tbody></table><table width=""100%"" border=""1px"" cellspacing=""0"" cellpadding=""10""><tbody><tr><td><span class=""H2"">preparation</span><br><p class=""H1"">      Wash and scrub potatoes.  Cut slits in tops.  Place each potato in a piece of aluminum foil.  Wrap securely.  Place on grill 6 inches from heat, tops down, for 20 minutes.  Turn.  Pierce foil tops with a fork.  Cook for 20 minutes or longer until desired doneness.  Cut foil open.  Combine cloves and butter.  Let stand for 5 minutes.</p></td></tr></tbody></table>"
"1520704691-482","http://www.cookbooks.com/","Vegetable","http://www.cookbooks.com/recipes-search.aspx?cid=1004&tag=Vegetable","9","http://www.cookbooks.com/recipes-search.aspx?page=9","127. SWEET AND SOUR CABBAGE","http://www.cookbooks.com/Recipe-Details.aspx?id=1665","<p class=""H2""><font size=""5"">SWEET AND SOUR CABBAGE</font><br><span class=""H2""><font size=""4""><i></i></font></span><br></p><hr><p class=""H3""><strong></strong></p><table width=""100%"" border=""1px"" cellspacing=""0"" cellpadding=""10""><tbody><tr><td><span class=""H2"">ingredients</span><br><p class=""H1"">6  c. shredded cabbage<br>3  c. water<br>1/4  tsp. pepper<br>1/2  c. bacon drippings<br>1/2  c. sugar<br>2  tsp. salt<br>3  Tbsp. flour (rounded)<br>1/4  c. vinegar<br></p></td></tr></tbody></table><table width=""100%"" border=""1px"" cellspacing=""0"" cellpadding=""10""><tbody><tr><td><span class=""H2"">preparation</span><br><p class=""H1"">      Mix all together and cook over medium heat until tender.  If cabbage seems to be quite moist, cut water by 1/2 cup.</p></td></tr></tbody></table>"
"1520704848-551","http://www.cookbooks.com/","Vegetable","http://www.cookbooks.com/recipes-search.aspx?cid=1004&tag=Vegetable","4","http://www.cookbooks.com/recipes-search.aspx?page=4","58. BRIGHT GREEN BEANS","http://www.cookbooks.com/Recipe-Details.aspx?id=1148","<p class=""H2""><font size=""5"">BRIGHT GREEN BEANS</font><br><span class=""H2""><font size=""4""><i></i></font></span><br></p><hr><p class=""H3""><strong></strong></p><table width=""100%"" border=""1px"" cellspacing=""0"" cellpadding=""10""><tbody><tr><td><span class=""H2"">ingredients</span><br><p class=""H1"">1 (10 oz.)  pkg. frozen green beans, whole or cut into pieces<br>1/2  c. chicken stock or broth<br>1  Tbsp. onion, minced or 1 Tbsp. dried onion flakes<br></p></td></tr></tbody></table><table width=""100%"" border=""1px"" cellspacing=""0"" cellpadding=""10""><tbody><tr><td><span class=""H2"">preparation</span><br><p class=""H1"">      Take your nonstick frying pan and spread the frozen beans over the bottom.  Add broth and onions and simmer over low heat until liquid evaporates.  Stir often so that beans cook evenly.  Don't cover the pan; beans cooked in a covered pan quickly lose their color and end up a sickly gray-green.  Beans should be crisp and tender by the time the water disappears.  If not cooked sufficiently, add a little more broth, but take care not to overcook.  Don't throw away the pan juices that remain; serve them over the beans.  Serves 3.</p></td></tr></tbody></table>"
"1520704383-361","http://www.cookbooks.com/","Vegetable","http://www.cookbooks.com/recipes-search.aspx?cid=1004&tag=Vegetable","17","http://www.cookbooks.com/recipes-search.aspx?page=17","249. STUFFED MUSHROOMS","http://www.cookbooks.com/Recipe-Details.aspx?id=3688","<p class=""H2""><font size=""5"">STUFFED MUSHROOMS</font><br><span class=""H2""><font size=""4""><i></i></font></span><br></p><hr><p class=""H3""><strong></strong></p><table width=""100%"" border=""1px"" cellspacing=""0"" cellpadding=""10""><tbody><tr><td><span class=""H2"">ingredients</span><br><p class=""H1"">3  dozen medium mushrooms<br>2  cloves garlic, finely chopped<br>1  c. toasted bread crumbs<br>1/2  c. grated Parmesan cheese<br>1  egg, well   beaten<br>2  Tbsp. olive oil<br>6  tbsp. chopped parsley<br>2  oz. dry white wine<br>  Salt &amp; pepper, to taste<br>  butter<br></p></td></tr></tbody></table><table width=""100%"" border=""1px"" cellspacing=""0"" cellpadding=""10""><tbody><tr><td><span class=""H2"">preparation</span><br><p class=""H1"">      Wash mushrooms, remove stems, chop stems and combine with garlic, bread crumbs, cheese, eggs, salt, pepper and oil. Stuff mushrooms with above filling. Sprinkle with  parsley, dot with butter. Place in shallow baking dish. Pour wine over all. Bake at 400°F. for 15 minutes.</p></td></tr></tbody></table>"
"1520704903-575","http://www.cookbooks.com/","Vegetable","http://www.cookbooks.com/recipes-search.aspx?cid=1004&tag=Vegetable","3","http://www.cookbooks.com/recipes-search.aspx?page=3","34. COOL AS A CUCUMBER","http://www.cookbooks.com/Recipe-Details.aspx?id=962","<p class=""H2""><font size=""5"">COOL AS A CUCUMBER</font><br><span class=""H2""><font size=""4""><i></i></font></span><br></p><hr><p class=""H3""><strong></strong></p><table width=""100%"" border=""1px"" cellspacing=""0"" cellpadding=""10""><tbody><tr><td><span class=""H2"">ingredients</span><br><p class=""H1"">1  c. sour cream<br>1  cucumber, peeled, seeded and sliced<br>1/4  tsp. dry mustard<br>1/2  tsp. instant chicken bouillon<br>1  Tbsp. snipped chives or 1 green onion<br>  salt and pepper to taste<br></p></td></tr></tbody></table><table width=""100%"" border=""1px"" cellspacing=""0"" cellpadding=""10""><tbody><tr><td><span class=""H2"">preparation</span><br><p class=""H1"">      Put all ingredients into a blender and blend until cucumber is finely chopped, not smooth.  Chill and serve.  Garnish with a sprinkle of dill or chives.</p></td></tr></tbody></table>"
"1520704613-447","http://www.cookbooks.com/","Vegetable","http://www.cookbooks.com/recipes-search.aspx?cid=1004&tag=Vegetable","11","http://www.cookbooks.com/recipes-search.aspx?page=11","162. CHEESY POTATOES FOR THE BARBECUE","http://www.cookbooks.com/Recipe-Details.aspx?id=2316","<p class=""H2""><font size=""5"">CHEESY POTATOES FOR THE BARBECUE</font><br><span class=""H2""><font size=""4""><i></i></font></span><br></p><hr><p class=""H3""><strong></strong></p><table width=""100%"" border=""1px"" cellspacing=""0"" cellpadding=""10""><tbody><tr><td><span class=""H2"">ingredients</span><br><p class=""H1"">4  slices bacon<br>3  large baking potatoes<br>1  large onion, sliced<br>1  c. cubed processed cheese<br>3/4  tsp. salt<br>1/4  tsp. pepper<br>1/2  tsp. dried leaf chervil<br>2  Tbsp. butter<br>1  Tbsp. bacon fat<br></p></td></tr></tbody></table><table width=""100%"" border=""1px"" cellspacing=""0"" cellpadding=""10""><tbody><tr><td><span class=""H2"">preparation</span><br><p class=""H1"">      Fry bacon until crisp.  Drain on paper towel and crumble.  Peel and slice potatoes onto a large piece of double heavy-duty aluminum foil.  Add onions separated into rings.  Add bacon bits, cheese, salt, pepper and chervil and toss all together lightly.  Dot with butter and drizzle bacon fat over all.  Wrap foil loosely around the potatoes making double folds to seal well.  Cook about 4-inches from hot coals for 1 hour or until tender, turning the package often.  Note:  Bake in oven at 400° for about the same time, if desired.  Serves 4.</p></td></tr></tbody></table>"
"1520704900-574","http://www.cookbooks.com/","Vegetable","http://www.cookbooks.com/recipes-search.aspx?cid=1004&tag=Vegetable","3","http://www.cookbooks.com/recipes-search.aspx?page=3","35. YELLOW ONION SOUP","http://www.cookbooks.com/Recipe-Details.aspx?id=963","<p class=""H2""><font size=""5"">YELLOW ONION SOUP</font><br><span class=""H2""><font size=""4""><i></i></font></span><br></p><hr><p class=""H3""><strong></strong></p><table width=""100%"" border=""1px"" cellspacing=""0"" cellpadding=""10""><tbody><tr><td><span class=""H2"">ingredients</span><br><p class=""H1"">6  oz. onions, thinly sliced<br>2  Tbsp. butter<br>2 level  Tbsp. flour<br>5  c. beef stock<br>  salt to taste<br>  pepper to taste<br>  Mozzarella or Swiss cheese<br></p></td></tr></tbody></table><table width=""100%"" border=""1px"" cellspacing=""0"" cellpadding=""10""><tbody><tr><td><span class=""H2"">preparation</span><br><p class=""H1"">      Sauté the onions in the butter for a moment.  Sprinkle them with the flour and as soon as they start to brown, stir in the stock.  Add salt and pepper to taste and cook for about 20 minutes.</p><p class=""H1"">      Put grated cheese in bottom of serving bowls and serve.</p></td></tr></tbody></table>"
"1520704617-449","http://www.cookbooks.com/","Vegetable","http://www.cookbooks.com/recipes-search.aspx?cid=1004&tag=Vegetable","11","http://www.cookbooks.com/recipes-search.aspx?page=11","160. ROASTED GARLIC POTATOES","http://www.cookbooks.com/Recipe-Details.aspx?id=2314","<p class=""H2""><font size=""5"">ROASTED GARLIC POTATOES</font><br><span class=""H2""><font size=""4""><i></i></font></span><br></p><hr><p class=""H3""><strong></strong></p><table width=""100%"" border=""1px"" cellspacing=""0"" cellpadding=""10""><tbody><tr><td><span class=""H2"">ingredients</span><br><p class=""H1"">2  Tbsp. vegetable oil<br>1  clove garlic<br>1  tsp. dried rosemary<br>4  medium potatoes<br>2  Tbsp. Parmesan cheese<br>1/4  tsp. pepper<br></p></td></tr></tbody></table><table width=""100%"" border=""1px"" cellspacing=""0"" cellpadding=""10""><tbody><tr><td><span class=""H2"">preparation</span><br><p class=""H1"">      Lightly grease a large cookie sheet.  Wash potatoes and slice 1/8-inch thick.  Mix oil, garlic and rosemary.  Brush on potatoes. Sprinkle with cheese and pepper.  Bake at 400° for 30 minutes, until lightly browned and crisp.</p></td></tr></tbody></table>"
"1520704754-510","http://www.cookbooks.com/","Vegetable","http://www.cookbooks.com/recipes-search.aspx?cid=1004&tag=Vegetable","7","http://www.cookbooks.com/recipes-search.aspx?page=7","99. POTATOES ON A GRILL","http://www.cookbooks.com/Recipe-Details.aspx?id=1481","<p class=""H2""><font size=""5"">POTATOES ON A GRILL</font><br><span class=""H2""><font size=""4""><i></i></font></span><br></p><hr><p class=""H3""><strong></strong></p><table width=""100%"" border=""1px"" cellspacing=""0"" cellpadding=""10""><tbody><tr><td><span class=""H2"">ingredients</span><br><p class=""H1"">  potatoes (uncooked), sliced thin<br>  green peppers, cut in pieces<br>1  large onion, chopped (or more if desired)<br>  paprika, salt and pepper<br>  butter<br></p></td></tr></tbody></table><table width=""100%"" border=""1px"" cellspacing=""0"" cellpadding=""10""><tbody><tr><td><span class=""H2"">preparation</span><br><p class=""H1"">      Mix together potatoes, green peppers and onion.  Season with paprika, salt and pepper.  Put mixture on heavy-duty foil and dab butter on top in several places.  (Spraying the inside of foil with Pam helps a lot!)  Wrap the potatoes in the foil real well and cook on grill, turning often, about 1/2 hour.  Can be done in oven at about 400°.</p></td></tr></tbody></table>"
"1520704763-514","http://www.cookbooks.com/","Vegetable","http://www.cookbooks.com/recipes-search.aspx?cid=1004&tag=Vegetable","7","http://www.cookbooks.com/recipes-search.aspx?page=7","95. GRILLED CORN","http://www.cookbooks.com/Recipe-Details.aspx?id=1477","<p class=""H2""><font size=""5"">GRILLED CORN</font><br><span class=""H2""><font size=""4""><i></i></font></span><br></p><table width=""100%"" border=""0"" cellspacing=""2"" cellpending=""5""><tbody><tr><td valign=""top""><p class=""H2""><img src=""images-new/recipe-categories/grilling-corn.jpg"" alt=""GRILLED CORN"" border=""0"" width=""200""></p></td><td valign=""middle""><p class=""H1""></p></td></tr></tbody></table><hr><p class=""H3""><strong></strong></p><table width=""100%"" border=""1px"" cellspacing=""0"" cellpadding=""10""><tbody><tr><td><span class=""H2"">ingredients</span><br><p class=""H1"">  tender sweet corn<br>  butter<br>  salt and pepper<br></p></td></tr></tbody></table><table width=""100%"" border=""1px"" cellspacing=""0"" cellpadding=""10""><tbody><tr><td><span class=""H2"">preparation</span><br><p class=""H1"">      Strip husks down to the end of the cob, but do not tear off. Remove silk.  If desired, soak in salted ice water to which 1/2 cup milk has been added for about 20 minutes; drain well.  Brush with softened butter and sprinkle with salt and pepper.  Bring husks up around the corn.  Wrap each ear securely in a double thickness of aluminum foil.  Twist the ends well.  Barbecue on briquets 10 minutes, turning once.</p></td></tr></tbody></table>"
"1520704665-471","http://www.cookbooks.com/","Vegetable","http://www.cookbooks.com/recipes-search.aspx?cid=1004&tag=Vegetable","10","http://www.cookbooks.com/recipes-search.aspx?page=10","138. MUSHROOM OMELET","http://www.cookbooks.com/Recipe-Details.aspx?id=1952","<p class=""H2""><font size=""5"">MUSHROOM OMELET</font><br><span class=""H2""><font size=""4""><i></i></font></span><br></p><hr><p class=""H3""><strong></strong></p><table width=""100%"" border=""1px"" cellspacing=""0"" cellpadding=""10""><tbody><tr><td><span class=""H2"">ingredients</span><br><p class=""H1"">1  c. sliced mushrooms (about 1/4 lb.)<br>1/3  c. chopped onion<br>1/4  c. chopped green peppers<br>1  medium garlic clove, minced<br>6  tsp. butter or margarine<br>6  or 12 eggs<br>1  c. water<br>1 (10 3/4 oz.)  can condensed tomato soup<br>1  large bay leaf<br>1/8  tsp. cayenne pepper<br>  salt and pepper to taste<br></p></td></tr></tbody></table><table width=""100%"" border=""1px"" cellspacing=""0"" cellpadding=""10""><tbody><tr><td><span class=""H2"">preparation</span><br><p class=""H1"">      Combine mushrooms, onion, green pepper and garlic in 2 teaspoons margarine in small saucepan and cook until tender.  In another saucepan, blend water, soup, bay leaf, cayenne pepper, salt and pepper to taste and bring to a boil.  Reduce heat and simmer 30 minutes, stirring occasionally.  Remove bay leaf.  Keep sauce hot.</p><p class=""H1"">      Melt 4 teaspoons margarine in large skillet and heat to 350°. Whip eggs until fluffy and pour into hot skillet.  When eggs are set on bottom, but still moist on top, cover with mushroom filling. Fold over once, slide onto a warm platter and spread with sauce.</p></td></tr></tbody></table>"
"1520704282-316","http://www.cookbooks.com/","Vegetable","http://www.cookbooks.com/recipes-search.aspx?cid=1004&tag=Vegetable","20","http://www.cookbooks.com/recipes-search.aspx?page=20","294. VEGETABLE SALAD","http://www.cookbooks.com/Recipe-Details.aspx?id=5081","<p class=""H2""><font size=""5"">VEGETABLE SALAD</font><br><span class=""H2""><font size=""4""><i></i></font></span><br></p><hr><p class=""H3""><strong></strong></p><table width=""100%"" border=""1px"" cellspacing=""0"" cellpadding=""10""><tbody><tr><td><span class=""H2"">ingredients</span><br><p class=""H1"">1  can French-style green beans<br>1  can tiny English peas (No. 2 can)<br>1  can Shoe Peg corn<br>1 large  jar pimento<br>1/2  c. celery, chopped<br>1/2  c. onion<br>1/2  c. green pepper<br></p></td></tr></tbody></table><table width=""100%"" border=""1px"" cellspacing=""0"" cellpadding=""10""><tbody><tr><td><span class=""H2"">preparation</span><br><p class=""H1"">      Mix well and marinate overnight.</p></td></tr></tbody></table>"
"1520704512-402","http://www.cookbooks.com/","Vegetable","http://www.cookbooks.com/recipes-search.aspx?cid=1004&tag=Vegetable","14","http://www.cookbooks.com/recipes-search.aspx?page=14","207. BOSTON BAKED BEANS","http://www.cookbooks.com/Recipe-Details.aspx?id=2592","<p class=""H2""><font size=""5"">BOSTON BAKED BEANS</font><br><span class=""H2""><font size=""4""><i></i></font></span><br></p><hr><p class=""H3""><strong></strong></p><table width=""100%"" border=""1px"" cellspacing=""0"" cellpadding=""10""><tbody><tr><td><span class=""H2"">ingredients</span><br><p class=""H1"">2  qt. bean pot<br>2  lb. pea beans<br>1  tsp. baking soda<br>1/2  lb. salt pork<br>8  Tbsp. sugar<br>2/3  c. molasses<br>2  tsp. dry mustard<br>1/2  tsp. pepper<br></p></td></tr></tbody></table><table width=""100%"" border=""1px"" cellspacing=""0"" cellpadding=""10""><tbody><tr><td><span class=""H2"">preparation</span><br><p class=""H1"">      Soak beans overnight.  In morning, parboil them for 10 minutes with a teaspoon of baking soda, then run cold water through the beans in a colander.  Dice rind of salt pork in 1-inch squares; cut in half.  Put half in 2-quart bean pot (bottom).  Put beans in pot. Put rest of pork on top.  Mix other ingredients with hot water. Pour over beans.  Bake in 300° oven for 6 hours.  Add more water when needed.  Uncover for last half hour.</p></td></tr></tbody></table>"
"1520704349-346","http://www.cookbooks.com/","Vegetable","http://www.cookbooks.com/recipes-search.aspx?cid=1004&tag=Vegetable","18","http://www.cookbooks.com/recipes-search.aspx?page=18","264. SPINACH CHEESE SQUARES","http://www.cookbooks.com/Recipe-Details.aspx?id=4256","<p class=""H2""><font size=""5"">SPINACH CHEESE SQUARES</font><br><span class=""H2""><font size=""4""><i></i></font></span><br></p><hr><p class=""H3""><strong></strong></p><table width=""100%"" border=""1px"" cellspacing=""0"" cellpadding=""10""><tbody><tr><td><span class=""H2"">ingredients</span><br><p class=""H1"">1  Tbsp. butter<br>3  eggs<br>1  cup flour<br>1  cup milk<br>1  tsp. salt<br>  dash of pepper<br>1  tsp. baking powder<br>1  pound monterey jack cheese, shredded<br>2  pkg. frozen spinach, thawed and drained<br>1  tsp. minced onion<br></p></td></tr></tbody></table><table width=""100%"" border=""1px"" cellspacing=""0"" cellpadding=""10""><tbody><tr><td><span class=""H2"">preparation</span><br><p class=""H1"">      Preheat oven to 350 degrees.  Squeeze spinach dry.  Melt butter in a 9 by 13 or jellyroll pan.  Remove from heat.  In a large bowl beat eggs, flour, milk, and seasonings.  Add cheese, spinach, and onion.  Pour into baking dish and bake 25-35 minutes. Cool for 45 minutes to set.  Cut into bite sized squares.</p><p class=""H1"">      To freeze:  Freeze squares on cookie sheet, and transfer to air tight container.</p><p class=""H1"">      Reheat: 12 minutes at 325 degrees.</p></td></tr></tbody></table>"
"1520704553-421","http://www.cookbooks.com/","Vegetable","http://www.cookbooks.com/recipes-search.aspx?cid=1004&tag=Vegetable","13","http://www.cookbooks.com/recipes-search.aspx?page=13","188. STUFFED MUSHROOMS","http://www.cookbooks.com/Recipe-Details.aspx?id=2502","<p class=""H2""><font size=""5"">STUFFED MUSHROOMS</font><br><span class=""H2""><font size=""4""><i></i></font></span><br></p><hr><p class=""H3""><strong></strong></p><table width=""100%"" border=""1px"" cellspacing=""0"" cellpadding=""10""><tbody><tr><td><span class=""H2"">ingredients</span><br><p class=""H1"">2  lb. fresh mushrooms<br>2  Tbsp. butter<br>1/3  c. onion, diced<br>1/2  lb. sausage<br>1 small  box frozen spinach<br>1/2  lb. Monterey Jack cheese, grated<br></p></td></tr></tbody></table><table width=""100%"" border=""1px"" cellspacing=""0"" cellpadding=""10""><tbody><tr><td><span class=""H2"">preparation</span><br><p class=""H1"">      Clean mushrooms, cutting off stems.  Dice 1/2 cup mushroom stems.  Sauté onion and mushroom stems in butter.  Cook sausage and drain.  In saucepan, cook spinach, then drain.  Mix sautéed onion, mushroom stems, sausage, spinach and cheese.  Stuff mushrooms. Place in shallow greased pan.  Bake at 350° for 15 minutes.</p></td></tr></tbody></table>"
"1520704478-387","http://www.cookbooks.com/","Vegetable","http://www.cookbooks.com/recipes-search.aspx?cid=1004&tag=Vegetable","15","http://www.cookbooks.com/recipes-search.aspx?page=15","222. BARBECUE BAKED BEANS","http://www.cookbooks.com/Recipe-Details.aspx?id=2749","<p class=""H2""><font size=""5"">BARBECUE BAKED BEANS</font><br><span class=""H2""><font size=""4""><i></i></font></span><br></p><hr><p class=""H3""><strong></strong></p><table width=""100%"" border=""1px"" cellspacing=""0"" cellpadding=""10""><tbody><tr><td><span class=""H2"">ingredients</span><br><p class=""H1"">1  lb. ground beef (chuck)<br>1  lb. bacon, chopped<br>1  large onion, chopped<br>1/2  c. catsup<br>1/2  c. barbecue sauce<br>1  tsp. salt<br>4  Tbsp. prepared mustard<br>4  Tbsp. molasses<br>1  tsp. chili powder<br>3/4  tsp. pepper<br>2 (16 oz.)  cans red kidney beans<br>2 (16 oz.)  cans pork and beans<br>2 (16 oz.)  cans butter beans<br></p></td></tr></tbody></table><table width=""100%"" border=""1px"" cellspacing=""0"" cellpadding=""10""><tbody><tr><td><span class=""H2"">preparation</span><br><p class=""H1"">      Brown ground beef, bacon and onion.  Drain excess fat.  Combine and add all other ingredients except the beans.  Stir well.  Add beans and combine thoroughly.  Bake for 1 hour at 350°. Makes 20 to 24 servings.</p></td></tr></tbody></table>"
"1520704594-439","http://www.cookbooks.com/","Vegetable","http://www.cookbooks.com/recipes-search.aspx?cid=1004&tag=Vegetable","12","http://www.cookbooks.com/recipes-search.aspx?page=12","170. MACARONI AND CHEESE","http://www.cookbooks.com/Recipe-Details.aspx?id=2328","<p class=""H2""><font size=""5"">MACARONI AND CHEESE</font><br><span class=""H2""><font size=""4""><i></i></font></span><br></p><hr><p class=""H3""><strong></strong></p><table width=""100%"" border=""1px"" cellspacing=""0"" cellpadding=""10""><tbody><tr><td><span class=""H2"">ingredients</span><br><p class=""H1"">1 1/2  c. macaroni<br>2  Tbsp. all-purpose flour<br>2  c. cubed cheese<br>3  Tbsp. margarine<br>2  c. milk<br></p></td></tr></tbody></table><table width=""100%"" border=""1px"" cellspacing=""0"" cellpadding=""10""><tbody><tr><td><span class=""H2"">preparation</span><br><p class=""H1"">      Cook macaroni in saltwater.  In saucepan, melt margarine and blend in flour.  Add milk.  Cook and stir until thick and bubbly. Add cheese.  Stir until melted.  Mix cheese sauce and macaroni together in a 1 1/2-quart bowl.</p></td></tr></tbody></table>"
"1520704286-318","http://www.cookbooks.com/","Vegetable","http://www.cookbooks.com/recipes-search.aspx?cid=1004&tag=Vegetable","20","http://www.cookbooks.com/recipes-search.aspx?page=20","292. BROCCOLI SALAD","http://www.cookbooks.com/Recipe-Details.aspx?id=4970","<p class=""H1"">Could NOT Open Recipe Page Due To:</p>Conversion from type 'DBNull' to type 'String' is not valid."
"1520704320-333","http://www.cookbooks.com/","Vegetable","http://www.cookbooks.com/recipes-search.aspx?cid=1004&tag=Vegetable","19","http://www.cookbooks.com/recipes-search.aspx?page=19","277. BROCCOLI SALAD","http://www.cookbooks.com/Recipe-Details.aspx?id=4633","<p class=""H2""><font size=""5"">BROCCOLI SALAD</font><br><span class=""H2""><font size=""4""><i></i></font></span><br></p><hr><p class=""H3""><strong></strong></p><table width=""100%"" border=""1px"" cellspacing=""0"" cellpadding=""10""><tbody><tr><td><span class=""H2"">ingredients</span><br><p class=""H1"">1  bunch broccoli, cut only tops into small bites<br>1  red onion, chopped<br>1/2  lb swiss cheese, grated<br>1/2  lb bacon, fried and crumbled<br>1  c mayonnaise<br>1/2  c sugar<br>1/4  c vinegar<br></p></td></tr></tbody></table><table width=""100%"" border=""1px"" cellspacing=""0"" cellpadding=""10""><tbody><tr><td><span class=""H2"">preparation</span><br><p class=""H1"">      Toss all together.</p></td></tr></tbody></table>"
"1520704880-564","http://www.cookbooks.com/","Vegetable","http://www.cookbooks.com/recipes-search.aspx?cid=1004&tag=Vegetable","3","http://www.cookbooks.com/recipes-search.aspx?page=3","45. SPANISH RICE SOUP","http://www.cookbooks.com/Recipe-Details.aspx?id=976","<p class=""H2""><font size=""5"">SPANISH RICE SOUP</font><br><span class=""H2""><font size=""4""><i></i></font></span><br></p><hr><p class=""H3""><strong></strong></p><table width=""100%"" border=""1px"" cellspacing=""0"" cellpadding=""10""><tbody><tr><td><span class=""H2"">ingredients</span><br><p class=""H1"">2  c. uncooked rice<br>6  Tbsp. lard<br>2  small onions, finely chopped<br>2  cloves garlic, minced<br>4  medium sized tomatoes, peeled and chopped or 1 c. tomato puree<br>4  c. regular strength beef or chicken broth<br>2  or 3 canned green chile slices, chopped<br>2  Tbsp. chopped parsley<br>1  c. pimiento-stuffed green olives<br></p></td></tr></tbody></table><table width=""100%"" border=""1px"" cellspacing=""0"" cellpadding=""10""><tbody><tr><td><span class=""H2"">preparation</span><br><p class=""H1"">      Brown rice lightly in lard.  Add onions, garlic and tomatoes. Cook 2 to 3 minutes.  Add 3 cups of broth.  Cover and simmer on top of range 25 to 30 minutes or bake in covered casserole in 350° oven for 50 to 60 minutes.  Garnish with chiles, parsley and olives. Use leftover broth, if you want a more moist rice.</p></td></tr></tbody></table>"
