web-scraper-order,web-scraper-start-url,veg,veg-href,page,page-href,title,title-href,info
"1520704322-334","http://www.cookbooks.com/","Vegetable","http://www.cookbooks.com/recipes-search.aspx?cid=1004&tag=Vegetable","19","http://www.cookbooks.com/recipes-search.aspx?page=19","276. VEGETABLE SALAD","http://www.cookbooks.com/Recipe-Details.aspx?id=4624","<p class=""H2""><font size=""5"">VEGETABLE SALAD</font><br><span class=""H2""><font size=""4""><i></i></font></span><br></p><hr><p class=""H3""><strong></strong></p><table width=""100%"" border=""1px"" cellspacing=""0"" cellpadding=""10""><tbody><tr><td><span class=""H2"">ingredients</span><br><p class=""H1"">2  pkg. almond slivers<br>1  can Lesueur peas<br>1  can green beans<br>1  can Chinese vegetables<br>1  can water chestnuts<br>1  c. sugar<br>1  c. celery<br>1  medium onion<br>1/2  c. vinegar<br>1/4  c. oil<br></p></td></tr></tbody></table><table width=""100%"" border=""1px"" cellspacing=""0"" cellpadding=""10""><tbody><tr><td><span class=""H2"">preparation</span><br><p class=""H1"">      Mix sugar, vinegar, and oil.  In separate bowl, drain and mix vegetables.  Add almond slivers.   Mix all ingredients together.</p></td></tr></tbody></table>"
"1520704290-320","http://www.cookbooks.com/","Vegetable","http://www.cookbooks.com/recipes-search.aspx?cid=1004&tag=Vegetable","20","http://www.cookbooks.com/recipes-search.aspx?page=20","290. BROCCOLI SALAD","http://www.cookbooks.com/Recipe-Details.aspx?id=4864","<p class=""H2""><font size=""5"">BROCCOLI SALAD</font><br><span class=""H2""><font size=""4""><i></i></font></span><br></p><hr><p class=""H3""><strong></strong></p><table width=""100%"" border=""1px"" cellspacing=""0"" cellpadding=""10""><tbody><tr><td><span class=""H2"">ingredients</span><br><p class=""H1"">1  head cauliflower<br>1  bunch broccoli<br>3  small Bermuda onions<br></p></td></tr></tbody></table><table width=""100%"" border=""1px"" cellspacing=""0"" cellpadding=""10""><tbody><tr><td><span class=""H2"">preparation</span><br><p class=""H1"">      Wash and cut up. Place in large bowl.</p></td></tr></tbody></table><p class=""H3""><strong>Dressing:</strong></p><table width=""100%"" border=""1px"" cellspacing=""0"" cellpadding=""10""><tbody><tr><td><span class=""H2"">ingredients</span><br><p class=""H1"">2  c. sour cream<br>1/2  c. mayonnaise<br>1  tsp. lemon<br>1/2  tsp. garlic salt<br></p></td></tr></tbody></table><table width=""100%"" border=""1px"" cellspacing=""0"" cellpadding=""10""><tbody><tr><td><span class=""H2"">preparation</span><br><p class=""H1"">      Mix and pour over vegetables.  Refrigerate.</p></td></tr></tbody></table>"
"1520704278-314","http://www.cookbooks.com/","Vegetable","http://www.cookbooks.com/recipes-search.aspx?cid=1004&tag=Vegetable","20","http://www.cookbooks.com/recipes-search.aspx?page=20","296. GERMAN POTATO SALAD","http://www.cookbooks.com/Recipe-Details.aspx?id=5272","<p class=""H2""><font size=""5"">GERMAN POTATO SALAD</font><br><span class=""H2""><font size=""4""><i></i></font></span><br></p><hr><p class=""H3""><strong>Salad Preparation:</strong></p><table width=""100%"" border=""1px"" cellspacing=""0"" cellpadding=""10""><tbody><tr><td><span class=""H2"">ingredients</span><br><p class=""H1"">4  slices bacon, diced and browned<br>1/4  c. bacon drippings<br>1  hard boiled egg<br>4  c. cold cubed potatoes<br>2  Tbsp. chopped onion<br>  sprig of parsley<br></p></td></tr></tbody></table><table width=""100%"" border=""1px"" cellspacing=""0"" cellpadding=""10""><tbody><tr><td><span class=""H2"">preparation</span><br><p class=""H1"">	Place potatoes, onions, eggs and parsley in a greased casserole or baking pan.  Pour dressing over potato mixture and mix to coat all.  Heat oven to 350° and cook for 30 minutes. Serves 6 to 8.</p></td></tr></tbody></table><p class=""H3""><strong>Dressing Preparation:</strong></p><table width=""100%"" border=""1px"" cellspacing=""0"" cellpadding=""10""><tbody><tr><td><span class=""H2"">ingredients</span><br><p class=""H1"">1/4  c. sugar<br>1/4  tsp. pepper<br>1  Tbsp. flour<br>1/4  c. vinegar<br>2  tsp. salt<br>2/3  c. water<br>1/4  c. bacon drippings<br></p></td></tr></tbody></table><table width=""100%"" border=""1px"" cellspacing=""0"" cellpadding=""10""><tbody><tr><td><span class=""H2"">preparation</span><br><p class=""H1"">	Combine sugar, flour, salt and pepper in top of double boiler.  Stir in vinegar, water, bacon drippings. Cook stirring constantly about 5 minutes or until thick.</p></td></tr></tbody></table>"
"1520704474-385","http://www.cookbooks.com/","Vegetable","http://www.cookbooks.com/recipes-search.aspx?cid=1004&tag=Vegetable","15","http://www.cookbooks.com/recipes-search.aspx?page=15","224. SWEET POTATOES","http://www.cookbooks.com/Recipe-Details.aspx?id=2796","<p class=""H2""><font size=""5"">SWEET POTATOES</font><br><span class=""H2""><font size=""4""><i></i></font></span><br></p><hr><p class=""H3""><strong></strong></p><table width=""100%"" border=""1px"" cellspacing=""0"" cellpadding=""10""><tbody><tr><td><span class=""H2"">ingredients</span><br><p class=""H1"">2  cans pineapple rings, drained<br>3  lb. sweet potatoes<br>1/2  stick butter<br>1/4 to 1/2  c. brown sugar (to taste)<br>  cinnamon to taste<br>  mini marshmallows<br>  maraschino cherries<br></p></td></tr></tbody></table><table width=""100%"" border=""1px"" cellspacing=""0"" cellpadding=""10""><tbody><tr><td><span class=""H2"">preparation</span><br><p class=""H1"">      Cook the sweet potatoes until fork-tender.  Drain and mash along with butter, brown sugar and cinnamon.  Scoop onto pineapple rings and top with marshmallows and 1/2 a cherry.  Heat at 450° for 5 minutes.</p></td></tr></tbody></table>"
"1520704854-554","http://www.cookbooks.com/","Vegetable","http://www.cookbooks.com/recipes-search.aspx?cid=1004&tag=Vegetable","4","http://www.cookbooks.com/recipes-search.aspx?page=4","55. MAMIE'S YAMS","http://www.cookbooks.com/Recipe-Details.aspx?id=1145","<p class=""H2""><font size=""5"">MAMIE'S YAMS</font><br><span class=""H2""><font size=""4""><i></i></font></span><br></p><hr><p class=""H3""><strong></strong></p><table width=""100%"" border=""1px"" cellspacing=""0"" cellpadding=""10""><tbody><tr><td><span class=""H2"">ingredients</span><br><p class=""H1"">4  large yams<br>1  Tbsp. orange juice<br>1  tsp. grated orange peel<br>1  tsp. vanilla<br>1/2  tsp. nutmeg<br>1/4  tsp. cinnamon<br>1  Tbsp. butter<br>1  egg, lightly beaten<br>1/2  c. whole milk<br>2  Tbsp. fructose<br></p></td></tr></tbody></table><table width=""100%"" border=""1px"" cellspacing=""0"" cellpadding=""10""><tbody><tr><td><span class=""H2"">preparation</span><br><p class=""H1"">      Boil the yams with the skins left on until tender.  Take them out of the water and cool.  Peel the yams and mash them.  Add orange juice, orange peel, vanilla, nutmeg, cinnamon and butter. Mix well.  Beat the egg lightly.  Mix the milk and fructose into the beaten egg and add this mixture to the yams.  Beat with a rotary beater until fluffy.  Bake at 325° for 20 minutes.  Turn off the oven and leave the yams in it for 1/2 hour longer.  This makes a nice cold side dish with a leftover turkey sandwich.</p><p class=""H1"">      Makes 12 servings.  Each serving contains:  1 bread exchange, 1/4 fat exchange, 81 calories.</p></td></tr></tbody></table>"
"1520704813-536","http://www.cookbooks.com/","Vegetable","http://www.cookbooks.com/recipes-search.aspx?cid=1004&tag=Vegetable","5","http://www.cookbooks.com/recipes-search.aspx?page=5","73. RED BEANS AND RICE","http://www.cookbooks.com/Recipe-Details.aspx?id=1316","<p class=""H2""><font size=""5"">RED BEANS AND RICE</font><br><span class=""H2""><font size=""4""><i></i></font></span><br></p><hr><p class=""H3""><strong></strong></p><table width=""100%"" border=""1px"" cellspacing=""0"" cellpadding=""10""><tbody><tr><td><span class=""H2"">ingredients</span><br><p class=""H1"">1  lb. red beans<br>2  cloves garlic, minced<br>2  Tbsp. chopped parsley<br>  black pepper, sea salt and Tabasco to taste<br>1  large yellow onion, grated<br>2  ribs celery, chopped<br>1  or 2 large bay leaves<br></p></td></tr></tbody></table><table width=""100%"" border=""1px"" cellspacing=""0"" cellpadding=""10""><tbody><tr><td><span class=""H2"">preparation</span><br><p class=""H1"">      Rinse and sort the beans.  Soak them overnight in 8 to 10 cups of cold water; do not change the water.  Bring the water to a soft boil.  As the water heats, mince the garlic and chop the celery, then saut them.  Add all with parsley, onion, bay leaves and seasonings to beans.  Cover and boil gently, stirring occasionally, for 2 to 3 hours.  It will thicken as the water reduces.  The last hour or so, you may wish to remove the lid.  Serve over rice.</p></td></tr></tbody></table>"
"1520704700-486","http://www.cookbooks.com/","Vegetable","http://www.cookbooks.com/recipes-search.aspx?cid=1004&tag=Vegetable","9","http://www.cookbooks.com/recipes-search.aspx?page=9","123. SOUR CREAM POTATOES ON GRILL","http://www.cookbooks.com/Recipe-Details.aspx?id=1505","<p class=""H2""><font size=""5"">SOUR CREAM POTATOES ON GRILL</font><br><span class=""H2""><font size=""4""><i></i></font></span><br></p><hr><p class=""H3""><strong></strong></p><table width=""100%"" border=""1px"" cellspacing=""0"" cellpadding=""10""><tbody><tr><td><span class=""H2"">ingredients</span><br><p class=""H1"">1 1/2  c. sliced, cooked potatoes or 1 (9 oz.) pkg. frozen French fries<br>1  Tbsp. butter<br>1  c. sour cream<br>1  packet dry onion soup mix<br>1/4  c. light cream<br></p></td></tr></tbody></table><table width=""100%"" border=""1px"" cellspacing=""0"" cellpadding=""10""><tbody><tr><td><span class=""H2"">preparation</span><br><p class=""H1"">      Place potatoes in center of 14-inch square of heavy-duty foil. Spread with butter.  Blend remaining ingredients and pour over potatoes.  Close foil and fold into secure package.  Grill over flame at medium setting 20 to 30 minutes.  Turn occasionally.</p></td></tr></tbody></table>"
"1520704822-540","http://www.cookbooks.com/","Vegetable","http://www.cookbooks.com/recipes-search.aspx?cid=1004&tag=Vegetable","5","http://www.cookbooks.com/recipes-search.aspx?page=5","69. CHEEZY ZUCCHINI CRISPS","http://www.cookbooks.com/Recipe-Details.aspx?id=1160","<p class=""H2""><font size=""5"">CHEEZY ZUCCHINI CRISPS</font><br><span class=""H2""><font size=""4""><i></i></font></span><br></p><hr><p class=""H3""><strong></strong></p><table width=""100%"" border=""1px"" cellspacing=""0"" cellpadding=""10""><tbody><tr><td><span class=""H2"">ingredients</span><br><p class=""H1"">1/3  c. cornflake crumbs<br>2  Tbsp. grated Parmesan cheese<br>1/2  tsp. seasoned salt<br>  dash of garlic powder<br>4  small unpeeled zucchini, cut in 3 x 1 1/2-inch strips<br>1/4  c. melted butter<br></p></td></tr></tbody></table><table width=""100%"" border=""1px"" cellspacing=""0"" cellpadding=""10""><tbody><tr><td><span class=""H2"">preparation</span><br><p class=""H1"">      Combine cornflake crumbs, cheese and seasonings; place in plastic bag.  Dip zucchini strips in butter, then shake in bag of crumbs to coat.  Place on baking sheet.  Bake at 375° for about 10 minutes or until crisp.</p><p class=""H1"">      Diabetic Exchanges - one serving = 1 bread, 1 vegetable, 2 fats, also 209 calories, 37 milligrams cholesterol, 21 grams carbohydrates, 4 grams protein, 12 grams fat.</p></td></tr></tbody></table>"
"1520704861-556","http://www.cookbooks.com/","Vegetable","http://www.cookbooks.com/recipes-search.aspx?cid=1004&tag=Vegetable","4","http://www.cookbooks.com/recipes-search.aspx?page=4","53. SWEET AND SOUR RED CABBAGE","http://www.cookbooks.com/Recipe-Details.aspx?id=1143","<p class=""H2""><font size=""5"">SWEET AND SOUR RED CABBAGE</font><br><span class=""H2""><font size=""4""><i></i></font></span><br></p><hr><p class=""H3""><strong></strong></p><table width=""100%"" border=""1px"" cellspacing=""0"" cellpadding=""10""><tbody><tr><td><span class=""H2"">ingredients</span><br><p class=""H1"">1  lb. red cabbage, shredded<br>1/2  c. cider vinegar<br>1/2  c. water<br>2  Tbsp. margarine<br>1/2  tsp. salt<br>  sugar substitute to equal 2 Tbsp. sugar<br></p></td></tr></tbody></table><table width=""100%"" border=""1px"" cellspacing=""0"" cellpadding=""10""><tbody><tr><td><span class=""H2"">preparation</span><br><p class=""H1"">      Place cabbage, vinegar, water, margarine and salt in a deep cooking pot.  Cover and cook until crisp-tender, about 15 minutes, lifting and turning with a large kitchen fork 2 or 3 times.  Remove from heat.  Dissolve artificial sweetener in small amount of water. Add to cabbage slowly, lifting and mixing well.  Drain and serve.</p></td></tr></tbody></table>"
"1520704564-426","http://www.cookbooks.com/","Vegetable","http://www.cookbooks.com/recipes-search.aspx?cid=1004&tag=Vegetable","13","http://www.cookbooks.com/recipes-search.aspx?page=13","183. BLACK-EYED PEAS","http://www.cookbooks.com/Recipe-Details.aspx?id=2341","<p class=""H2""><font size=""5"">BLACK-EYED PEAS</font><br><span class=""H2""><font size=""4""><i></i></font></span><br></p><hr><p class=""H3""><strong></strong></p><table width=""100%"" border=""1px"" cellspacing=""0"" cellpadding=""10""><tbody><tr><td><span class=""H2"">ingredients</span><br><p class=""H1"">2  lb. fresh shelled black-eyed peas<br>  salt to taste<br>3  Tbsp. bacon drippings or small piece salt pork<br></p></td></tr></tbody></table><table width=""100%"" border=""1px"" cellspacing=""0"" cellpadding=""10""><tbody><tr><td><span class=""H2"">preparation</span><br><p class=""H1"">      In 4-quart cast-iron pot, pour in peas and bacon drippings or the salt pork.  Add hot water to cover peas.  Cook slow 1 1/2 to 2 hours, until tender.  Salt to taste.</p></td></tr></tbody></table>"
"1520704915-580","http://www.cookbooks.com/","Vegetable","http://www.cookbooks.com/recipes-search.aspx?cid=1004&tag=Vegetable","2","http://www.cookbooks.com/recipes-search.aspx?page=2","29. BAKED ONIONS IN THEIR SKINS","http://www.cookbooks.com/Recipe-Details.aspx?id=623","<p class=""H2""><font size=""5"">BAKED ONIONS IN THEIR SKINS</font><br><span class=""H2""><font size=""4""><i></i></font></span><br></p><hr><p class=""H3""><strong></strong></p><table width=""100%"" border=""1px"" cellspacing=""0"" cellpadding=""10""><tbody><tr><td><span class=""H2"">ingredients</span><br><p class=""H1"">4  medium to large yellow or sweet Bermuda onions<br>1 1/2  Tbsp. unsalted butter or margarine, diced<br>  salt and freshly ground pepper to taste<br>  parsley sprigs (for garnish)<br></p></td></tr></tbody></table><table width=""100%"" border=""1px"" cellspacing=""0"" cellpadding=""10""><tbody><tr><td><span class=""H2"">preparation</span><br><p class=""H1"">      Preheat oven to 375°.  Line a small baking pan with aluminum foil and spray with vegetable cooking spray.  Trim off the root ends of the onions but leave the skin intact.  Place upright in the prepared pan and bake for 1 1/2 to 2 hours or until very tender. Remove the skins and discard.  Top each with melted butter or margarine.  Season with salt and pepper and serve piping hot, garnished with parsley sprigs.  Serves 4.</p></td></tr></tbody></table>"
"1520704532-412","http://www.cookbooks.com/","Vegetable","http://www.cookbooks.com/recipes-search.aspx?cid=1004&tag=Vegetable","14","http://www.cookbooks.com/recipes-search.aspx?page=14","197. PARMESAN POTATOES","http://www.cookbooks.com/Recipe-Details.aspx?id=2582","<p class=""H2""><font size=""5"">PARMESAN POTATOES</font><br><span class=""H2""><font size=""4""><i></i></font></span><br></p><hr><p class=""H3""><strong></strong></p><table width=""100%"" border=""1px"" cellspacing=""0"" cellpadding=""10""><tbody><tr><td><span class=""H2"">ingredients</span><br><p class=""H1"">1  stick butter<br>1/2  c. flour<br>1/2  c. Parmesan cheese<br>5  medium potatoes, cut in 1 1/2-inch cubes<br></p></td></tr></tbody></table><table width=""100%"" border=""1px"" cellspacing=""0"" cellpadding=""10""><tbody><tr><td><span class=""H2"">preparation</span><br><p class=""H1"">      Melt butter in 9 x 13-inch pan.  Mix flour and Parmesan cheese in  plastic bag.  Shake a few potato cubes in bag at a time  and put  in  buttered  pan.  Bake at 350° for 1/2 hour. With  spatula turn  over and bake another 1/2 hour.  Leftover cheese may be put in freezer for next time.</p></td></tr></tbody></table>"
"1520704609-445","http://www.cookbooks.com/","Vegetable","http://www.cookbooks.com/recipes-search.aspx?cid=1004&tag=Vegetable","11","http://www.cookbooks.com/recipes-search.aspx?page=11","164. SWEET POTATO CASSEROLE","http://www.cookbooks.com/Recipe-Details.aspx?id=2318","<p class=""H2""><font size=""5"">SWEET POTATO CASSEROLE</font><br><span class=""H2""><font size=""4""><i></i></font></span><br></p><hr><p class=""H3""><strong></strong></p><table width=""100%"" border=""1px"" cellspacing=""0"" cellpadding=""10""><tbody><tr><td><span class=""H2"">ingredients</span><br><p class=""H1"">3  c. sweet potatoes, mashed<br>1/2  c. butter, melted<br>2  eggs, beaten<br>1  c. sugar<br>1  tsp. vanilla<br></p></td></tr></tbody></table><table width=""100%"" border=""1px"" cellspacing=""0"" cellpadding=""10""><tbody><tr><td><span class=""H2"">preparation</span><br><p class=""H1"">      Mix together all ingredients.  Put in casserole bowl.</p></td></tr></tbody></table><p class=""H3""><strong>Top:</strong></p><table width=""100%"" border=""1px"" cellspacing=""0"" cellpadding=""10""><tbody><tr><td><span class=""H2"">ingredients</span><br><p class=""H1"">1/3  c. flour<br>1/2  c. butter, melted<br>1  c. brown sugar<br></p></td></tr></tbody></table><table width=""100%"" border=""1px"" cellspacing=""0"" cellpadding=""10""><tbody><tr><td><span class=""H2"">preparation</span><br><p class=""H1"">      Mix ingredients; pour over potato mixture.  Bake at 400° for 30 minutes.</p></td></tr></tbody></table>"
"1520704661-469","http://www.cookbooks.com/","Vegetable","http://www.cookbooks.com/recipes-search.aspx?cid=1004&tag=Vegetable","10","http://www.cookbooks.com/recipes-search.aspx?page=10","140. ZUCCHINI CASSEROLE","http://www.cookbooks.com/Recipe-Details.aspx?id=1954","<p class=""H2""><font size=""5"">ZUCCHINI CASSEROLE</font><br><span class=""H2""><font size=""4""><i></i></font></span><br></p><hr><p class=""H3""><strong></strong></p><table width=""100%"" border=""1px"" cellspacing=""0"" cellpadding=""10""><tbody><tr><td><span class=""H2"">ingredients</span><br><p class=""H1"">4  c. fresh zucchini<br>1  can Spanish rice<br>2  c. grated cheese<br>1  onion (medium size), chopped<br>1 small  jar pimiento, chopped<br>1  lb. ground beef<br></p></td></tr></tbody></table><table width=""100%"" border=""1px"" cellspacing=""0"" cellpadding=""10""><tbody><tr><td><span class=""H2"">preparation</span><br><p class=""H1"">      Brown ground beef; set aside.  Precook zucchini 10 minutes (do not overcook).  Place zucchini into a greased deep casserole dish (one layer).  Alternate layers with ground beef.  Add Spanish rice, pimiento and onion.  Bake in 350° oven for 20 minutes.  Remove from oven.  Add grated cheese on top.  Place back in oven for 5 minutes. Garnish with paprika and parsley.  Will serve 8 to 10 people.</p></td></tr></tbody></table>"
"1520704275-313","http://www.cookbooks.com/","Vegetable","http://www.cookbooks.com/recipes-search.aspx?cid=1004&tag=Vegetable","20","http://www.cookbooks.com/recipes-search.aspx?page=20","297. BROCCOLI SALAD","http://www.cookbooks.com/Recipe-Details.aspx?id=5276","<p class=""H2""><font size=""5"">BROCCOLI SALAD</font><br><span class=""H2""><font size=""4""><i></i></font></span><br></p><hr><p class=""H3""><strong>Salad Preparation:</strong></p><table width=""100%"" border=""1px"" cellspacing=""0"" cellpadding=""10""><tbody><tr><td><span class=""H2"">ingredients</span><br><p class=""H1"">2  heads broccoli, cut up<br>1/2  c. pecans chopped<br>1/2  c. raisins<br>1/2  c. red apples, chopped not peeled<br>1/2  c. red grapes<br></p></td></tr></tbody></table><table width=""100%"" border=""1px"" cellspacing=""0"" cellpadding=""10""><tbody><tr><td><span class=""H2"">preparation</span><br><p class=""H1"">	Combine and toss broccoli, nuts, raisins, apples, and grapes. Pour dressing over salad.</p></td></tr></tbody></table><p class=""H3""><strong>Dressing Preparation:</strong></p><table width=""100%"" border=""1px"" cellspacing=""0"" cellpadding=""10""><tbody><tr><td><span class=""H2"">ingredients</span><br><p class=""H1"">1  c. mayo<br>1/2  c. sugar<br>2  Tbsp. apple cider vinegar<br></p></td></tr></tbody></table><table width=""100%"" border=""1px"" cellspacing=""0"" cellpadding=""10""><tbody><tr><td><span class=""H2"">preparation</span><br><p class=""H1"">	Mix ingredients together well.</p></td></tr></tbody></table>"
"1520704761-513","http://www.cookbooks.com/","Vegetable","http://www.cookbooks.com/recipes-search.aspx?cid=1004&tag=Vegetable","7","http://www.cookbooks.com/recipes-search.aspx?page=7","96. FOIL WRAPPED VEGGIES ON GRILL","http://www.cookbooks.com/Recipe-Details.aspx?id=1478","<p class=""H2""><font size=""5"">FOIL WRAPPED VEGGIES ON GRILL</font><br><span class=""H2""><font size=""4""><i></i></font></span><br></p><hr><p class=""H3""><strong></strong></p><table width=""100%"" border=""1px"" cellspacing=""0"" cellpadding=""10""><tbody><tr><td><span class=""H2"">ingredients</span><br><p class=""H1"">3  medium zucchini, sliced<br>3  medium tomatoes, sliced<br>1  green pepper, sliced<br>1  envelope onion soup mix<br>1/4  c. margarine, softened<br>2  Tbsp. brown sugar<br>  salt and pepper<br></p></td></tr></tbody></table><table width=""100%"" border=""1px"" cellspacing=""0"" cellpadding=""10""><tbody><tr><td><span class=""H2"">preparation</span><br><p class=""H1"">      Cut a large square of heavy-duty aluminum foil.  Mix all ingredients and place on square.  Fold up securely so no juices escape.  Place on charcoal grill, turning once during cooking, 45 minutes to 1 hour.  May also be placed in 350° oven.  Serves 6.</p></td></tr></tbody></table>"
"1520704534-413","http://www.cookbooks.com/","Vegetable","http://www.cookbooks.com/recipes-search.aspx?cid=1004&tag=Vegetable","14","http://www.cookbooks.com/recipes-search.aspx?page=14","196. HONEY GLAZED BRANDIED CARROTS","http://www.cookbooks.com/Recipe-Details.aspx?id=2581","<p class=""H2""><font size=""5"">HONEY GLAZED BRANDIED CARROTS</font><br><span class=""H2""><font size=""4""><i></i></font></span><br></p><hr><p class=""H3""><strong></strong></p><table width=""100%"" border=""1px"" cellspacing=""0"" cellpadding=""10""><tbody><tr><td><span class=""H2"">ingredients</span><br><p class=""H1"">1  (1 lb.) bag frozen baby carrots<br>3  Tbsp. butter<br>3  Tbsp. honey<br>2  Tbsp. brandy<br>1 1/2  Tbsp. chopped parsley<br>  salt and pepper to taste<br></p></td></tr></tbody></table><table width=""100%"" border=""1px"" cellspacing=""0"" cellpadding=""10""><tbody><tr><td><span class=""H2"">preparation</span><br><p class=""H1"">      Cook  carrots  in  salted  water until they are tender; drain. In a skillet, place carrots and remaining ingredients; cook and stir until carrots are glazed and glossy.  Serves 6.</p></td></tr></tbody></table>"
"1520704410-373","http://www.cookbooks.com/","Vegetable","http://www.cookbooks.com/recipes-search.aspx?cid=1004&tag=Vegetable","16","http://www.cookbooks.com/recipes-search.aspx?page=16","237. STEWED TOMATOES","http://www.cookbooks.com/Recipe-Details.aspx?id=3173","<p class=""H2""><font size=""5"">STEWED TOMATOES</font><br><span class=""H2""><font size=""4""><i></i></font></span><br></p><hr><p class=""H3""><strong></strong></p><table width=""100%"" border=""1px"" cellspacing=""0"" cellpadding=""10""><tbody><tr><td><span class=""H2"">ingredients</span><br><p class=""H1"">4  qt. tomatoes, peeled, cored, chopped (abt. 2 dozen large)<br>1  c. celery, chopped<br>2  Tbsp. salt<br>1  Tbsp. sugar<br>1/2  c. onion, chopped<br>1/4  c. bell pepper, chopped<br>  hot pepper, (optional)<br></p></td></tr></tbody></table><table width=""100%"" border=""1px"" cellspacing=""0"" cellpadding=""10""><tbody><tr><td><span class=""H2"">preparation</span><br><p class=""H1"">      Combine all ingredients; cover and cook 10 minutes, stirring to prevent sticking. Pour into pint jars and seal. Place in pressure canner for 15 minutes at 10 lb. pressure. Pressure quarts for 20 minutes at 10 lb. pressure. Makes 7 pints.</p></td></tr></tbody></table>"
